"","title","lead.author","year","publication.type","genetics","genomic","evolution","sex.differences","dosage..test.","mechanism","cell.stuff","issue","development","epigenetics","methods","treatment","race","unsure","irrelevant","notes.etc"
"1","Sex Differences in Inflammatory Response and Acid-Base Balance in Prepubertal Children with Severe Sepsis","lefevre",2017,"case study","","","","x","","","","acute inflammatory conditions, sepsis","","","""reviewed clinical signs and biological inflammatory markers of prepubertal children qith sever sepsis""","","","","",""
"2","Xist attenuates acute inflammatory response by female cells","shenoda",2021,"study","xist","","","x","elevated xist levels","NF-kB nuclear migration, xci","mouse J774A.1 and human AML193 monocytes","lipopolysaccharide-mediated acute inflammation","","","","","","x","",""
"3","Sex differences of inflammatory and immune response in pups of Wistar rats with SIRS","kosyreva",2020,"experiment","","","","x","","""LPS-induced SIRS sex difference""; hormones","","inflammatory, immune response","","","","","","","","wistar rats"
"4","Gender differences and inflammation: An in vitro model of blood cells stimulation in prepubescent children","casimir",2010,"experiment","","","","x","","","","inflammatory disease","","","evaluated cyokines implicated in inflammatory processes, simulation by LPS..., overnight cultures","","","","",""
"5","Sex Differences in Inflammatory Cytokines and Cd99 Expression Following in Vitro Lipopolysaccharide Stimulation","Lefevre",2012,"study","CD99, CD11b, IL-8","","","x","","cytokine levels","","inflammatory response, inflammation","","","","","","","",""
"6","Sex differences in obesity, lipid metabolism, and inflammation—A role for the sex chromosomes?","Zore",2018,"review","","","","x","","exci","","obesity, inflammation","","","mice","","","","",""
