"","title","lead.author","year","publication.type","genetics","genomic","evolution","sex.differences","dosage..test.","mechanism","cell.stuff","issue","development","epigenetics","methods","treatment","race","unsure","irrelevant","notes.etc"
"1","X chromosome escapee genes are involved in ischemic sexual dimorphism through epigenetic modification of inflammatory signals\","qi",2021,"study","KDM6A, KDM5C","","","","","ovarian hormones, chrx dosage, exci, knockdown or over-expression, KDM-histone-irf pathway mediation of sex differences","","stroke","","chromatin immunoprecipitation","rnaseq in flow-sorted microglia from the aged male and female WT mice subjected to middle cerebral artery occlusion, four core genotype mice, immunohistochemistry, western blot, RT-PCR","","","","",""
"2","Abdullah al mamun","mamun",2019,"experiment","KDM6A, KDM5C","","","x","","xci, expression level, exci","","ischemic stroke","","","""Aged (18-22 months) WT C57BL/6 and FCG mice (XXF, XYF, XXM, and XYM) were subjected to a 60-minute middle cerebral artery occlusion (MCAO)"", initial screening of escapees using rnaseq, flow cytometry, pcr, ihc","","","","",""
"3","Sex-specific microRNAs in neurovascular units in ischemic stroke","florjin",2021,"review","","","","x","","sex-specific miRNA expression...","","stroke","","","","","","","",""
"4","An intronic haplotype in α galactosidase A is associated with reduced mRNA expression in males with cryptogenic stroke","zeevi",2014,"patinet study","fabry alpha-glactosidase gene (GLA)","","","","","","","fabry disease, early-onset stroke","","","patient studies (halotyping?)","","","","",""
"5","Y Chromosome Gene Expression in the Blood of Male Patients With Ischemic Stroke Compared With Male Controls","tian",2012,"experiment","","chrY","","x","","chrY gene expression","","ischemic stroke","","",""" RNA was isolated from blood and was processed using Affymetrix Human U133 Plus 2.0 expression arrays ""","","","","",""
"6","Sex differences in miRNA as therapies for ischemic stroke","sohrabji",2019,"review","","","","x","","","miRNA","stroke","","","","","","","",""
