"","key","title","year","month","day","journal","issn","volume","issue","pages","authors","url","language","publisher","location","abstract","notes","doi","keywords","pubmed_id","pmc_id"
"71","rayyan-902924743","Sex Differences in Immunity: Implications for the Development of Novel Vaccines Against Emerging Pathogens",2020,NA,NA,"Front Immunol","1664-3224",11,NA,"601170","Fathi, A. and Addo, M. M. and Dahlke, C.","",NA,NA,NA,"Vaccines are one of the greatest public health achievements and have saved millions of lives. They represent a key countermeasure to limit epidemics caused by emerging infectious diseases. The Ebola virus disease crisis in West Africa dramatically revealed the need for a rapid and strategic development of vaccines to effectively control outbreaks. Seven years later, in light of the SARS-CoV-2 pandemic, this need has never been as urgent as it is today. Vaccine development and implementation of clinical trials have been greatly accelerated, but still lack strategic design and evaluation. Responses to vaccination can vary widely across individuals based on factors like age, microbiome, co-morbidities and sex. The latter aspect has received more and more attention in recent years and a growing body of data provide evidence that sex-specific effects may lead to different outcomes of vaccine safety and efficacy. As these differences might have a significant impact on the resulting optimal vaccine regimen, sex-based differences should already be considered and investigated in pre-clinical and clinical trials. In this Review, we will highlight the clinical observations of sex-specific differences in response to vaccination, delineate sex differences in immune mechanisms, and will discuss the possible resulting implications for development of vaccine candidates against emerging infections. As multiple vaccine candidates against COVID-19 that target the same antigen are tested, vaccine development may undergo a decisive change, since we now have the opportunity to better understand mechanisms that influence vaccine-induced reactogenicity and effectiveness of different vaccines.","1664-3224 Fathi, Anahita Addo, Marylyn M Dahlke, Christine Journal Article Research Support, Non-U.S. Gov't Review Switzerland 2021/01/26 Front Immunol. 2021 Jan 8;11:601170. doi: 10.3389/fimmu.2020.601170. eCollection 2020.","10.3389/fimmu.2020.601170","Animals;COVID-19/immunology;Hemorrhagic Fever, Ebola/immunology;Humans;Immunity/*immunology;Pandemics/*prevention & control;SARS-CoV-2/immunology;*Sex Characteristics;Vaccination/methods;Viral Vaccines/*immunology;X-chromosome inactivation;X-linked gene products;emerging infections;genetic;hormones;miRNAs;sex differences;vaccine;Sex Characteristics;Vaccination",NA,NA
"72","rayyan-902924744","Sex differences in Mecp2-mutant Rett syndrome model mice and the impact of cellular mosaicism in phenotype development",2020,2,15,"Brain Res","0006-8993 (Print) 0006-8993",1729,NA,"146644","Ribeiro, M. C. and MacDonald, J. L.","",NA,NA,NA,"There is currently no effective treatment for Rett syndrome (RTT), a severe X-linked progressive neurodevelopmental disorder caused by mutations in the transcriptional regulator MECP2. Because MECP2 is subjected to X-inactivation, most affected individuals are female heterozygotes who display cellular mosaicism for normal and mutant MECP2. Males who are hemizygous for mutant MECP2 are more severely affected than heterozygous females and rarely survive. Mecp2 loss-of-function is less severe in mice, however, and male hemizygous null mice not only survive until adulthood, they have been the most commonly studied model system. Although heterozygous female mice better recapitulate human RTT, they have not been as thoroughly characterized. This is likely because of the added experimental challenges that they present, including delayed and more variable phenotypic progression and cellular mosaicism due to X-inactivation. In this review, we compare phenotypes of Mecp2 heterozygous female mice and male hemizygous null mouse models. Further, we discuss the complexities that arise from the many cell-type and tissue-type specific roles of MeCP2, as well as the combination of cell-autonomous and non-cell-autonomous disruptions that result from Mecp2 loss-of-function. This is of particular importance in the context of the female heterozygous brain, composed of a mixture of MeCP2+ and MeCP2- cells, the ratio of which can alter RTT phenotypes in the case of skewed X-inactivation. The goal of this review is to provide a clearer understanding of the pathophysiological differences between the mouse models, which is an essential consideration in the design of future pre-clinical studies.","1872-6240 Ribeiro, Mayara C MacDonald, Jessica L R01 NS106285/NS/NINDS NIH HHS/United States Journal Article Research Support, N.I.H., Extramural Research Support, Non-U.S. Gov't Review Netherlands 2020/01/07 Brain Res. 2020 Feb 15;1729:146644. doi: 10.1016/j.brainres.2019.146644. Epub 2020 Jan 2.","10.1016/j.brainres.2019.146644","Animals;*Disease Models, Animal;Female;Male;Methyl-CpG-Binding Protein 2/*genetics;Mice;Mosaicism;Mutation;Phenotype;Rett Syndrome/*genetics/*physiopathology;*Sex Characteristics;Epigenetics;MeCP2;Rett syndrome;Sex differences;X-chromosome inactivation;Rett Syndrome;Sex Characteristics",NA,NA
"73","rayyan-902924745","Heterogeneous Escape from X Chromosome Inactivation Results in Sex Differences in Type I IFN Responses at the Single Human pDC Level",2020,12,8,"Cell Rep","",33,10,"108485","Hagen, S. H. and Henseling, F. and Hennesen, J. and Savel, H. and Delahaye, S. and Richert, L. and Ziegler, S. M. and Altfeld, M.","",NA,NA,NA,"Immune responses differ between women and men, and type I interferon (IFN) responses following Toll-like receptor 7 (TLR7) stimulation are higher in women. The precise mechanisms driving these sex differences in immunity are unknown. To investigate possible genetic factors, we quantify escape from X chromosome inactivation (XCI) for TLR7 and four other genes (RPS6KA3, CYBB, BTK, and IL13RA1) at the single plasmacytoid dendritic cell (pDC) level. We observe escape from XCI for all investigated genes, leading to biallelic expression patterns. pDCs with biallelic gene expression have significantly higher mRNA levels of the respective genes. Unstimulated pDCs with biallelic TLR7 expression exhibit significantly higher IFNα/β mRNA levels, and IFNα exposure results in significantly increased IFNα/β protein production by pDCs. These results identify unanticipated heterogeneity in escape from XCI of several genes in pDCs and highlight the important contribution of X chromosome factors to sex differences in type I IFN responses, which might explain observed sex differences in human diseases.","2211-1247 Hagen, Sven Hendrik Henseling, Florian Hennesen, Jana Savel, Hélène Delahaye, Solenne Richert, Laura Ziegler, Susanne Maria Altfeld, Marcus Journal Article Research Support, Non-U.S. Gov't United States 2020/12/10 Cell Rep. 2020 Dec 8;33(10):108485. doi: 10.1016/j.celrep.2020.108485.","10.1016/j.celrep.2020.108485","Cells, Cultured;Dendritic Cells/immunology/*metabolism/physiology;Female;Gene Expression/genetics;Humans;Immunity, Innate/physiology;Interferon Type I/*metabolism/physiology;Male;RNA, Messenger/metabolism;Sex Characteristics;Sex Factors;Signal Transduction/genetics;Toll-Like Receptor 7/*metabolism;X Chromosome Inactivation/genetics/physiology;Ifnα;Tlr7;Xci;escape from X chromosome inactivation;pDCs;sex differences;type I IFN;Humanities;Humanism;X Chromosome",NA,NA
"74","rayyan-902924746","Sex-linked genetic mechanisms and atrial fibrillation risk",2022,4,NA,"Eur J Med Genet","1769-7212",65,4,"104459","Wren, G. and Davies, W.","",NA,NA,NA,"Atrial fibrillation (AF) is a cardiac condition characterised by an irregular heartbeat, atrial pathology and an elevated downstream risk of thrombosis and heart failure, as well as neurological sequelae including stroke and dementia. The prevalence and presentation of, risk factors for, and therapeutic responses to, AF differ by sex, and this sex bias may be partially explained in terms of genetics. Here, we consider four sex-linked genetic mechanisms that may influence sex-biased phenotypes related to AF and provide examples of each: X-linked gene dosage, X-linked genomic imprinting, sex-biased autosomal gene expression, and male-limited Y-linked gene expression. We highlight novel candidate risk genes and pathways that warrant further investigation in clinical and preclinical studies. Understanding the biological basis of sex differences in AF should allow better prediction of disease risk, identification of novel risk/protective factors, and the development of more effective sex-tailored interventions.","1878-0849 Wren, Georgina Davies, William Journal Article Review Netherlands 2022/02/22 Eur J Med Genet. 2022 Apr;65(4):104459. doi: 10.1016/j.ejmg.2022.104459. Epub 2022 Feb 19.","10.1016/j.ejmg.2022.104459","*Atrial Fibrillation/genetics;Female;Genes, X-Linked;Humans;Male;Phenotype;Risk Factors;*Stroke/genetics;Klinefelter syndrome;Steroid sulfatase;Turner syndrome;X chromosome;X-inactivation;Y chromosome;Atrial Fibrillation",NA,NA
"75","rayyan-902924747","Loss of epigenetic modifications on the inactive X chromosome and sex-biased gene expression profiles in B cells from NZB/W F1 mice with lupus-like disease",2020,2,NA,"J Autoimmun","0896-8411 (Print) 0896-8411",107,NA,"102357","Syrett, C. M. and Sierra, I. and Beethem, Z. T. and Dubin, A. H. and Anguera, M. C.","",NA,NA,NA,"The mechanisms underlying the female-bias in autoimmunity are poorly understood. The contribution of genetic and epigenetic factors from the inactive X chromosome (Xi) are beginning to emerge as critical mediators of autoimmunity in females. Here, we ask how epigenetic features of the Xi change during disease development in B cells from the NZB/W F1 spontaneous mouse model of lupus, which is female-biased. We find that Xist RNA becomes increasingly mislocalized from the Xi with disease onset. While NZB/W F1 naïve B cells have H3K27me3 foci on the Xi, which are missing from healthy C57BL/6 and BALB/c mice, these foci are progressively lost in stimulated B cells during disease. Using single-molecule RNA FISH, we show that the X-linked gene Tlr7 is biallelically expressed in ~20% of NZB/W F1 B cells, and that the amount of biallelic expression does not change with disease. We also present sex-specific gene expression profiles for diseased NZB/W F1 B cells, and find female-specific upregulation of 20 genes, including the autoimmunity-related genes Cxcl13, Msr1, Igj, and Prdm1. Together, these studies provide important insight into the loss of epigenetic modifications from the Xi and changes with gene expression in a mouse model of female-biased SLE.","1095-9157 Syrett, Camille M Sierra, Isabel Beethem, Zachary T Dubin, Aimee H Anguera, Montserrat C F31 GM123604/GM/NIGMS NIH HHS/United States R01 AI134834/AI/NIAID NIH HHS/United States R21 AI124084/AI/NIAID NIH HHS/United States T32 AI055428/AI/NIAID NIH HHS/United States Journal Article Research Support, N.I.H., Extramural Research Support, U.S. Gov't, Non-P.H.S. England 2019/11/30 J Autoimmun. 2020 Feb;107:102357. doi: 10.1016/j.jaut.2019.102357. Epub 2019 Nov 25.","10.1016/j.jaut.2019.102357","Animals;B-Lymphocytes/*immunology/*metabolism;Biomarkers;Computational Biology/methods;Disease Models, Animal;*Epigenesis, Genetic;Female;Gene Expression Regulation;In Situ Hybridization, Fluorescence;Lupus Erythematosus, Systemic/diagnosis/*etiology/*metabolism;Male;Mice;Mice, Inbred BALB C;Mice, Inbred NZB;Severity of Illness Index;Sex Factors;X Chromosome/*genetics;X Chromosome Inactivation/*genetics;B cells;Female-biased autoimmunity;H3K27me3;NZB/W F1 mice;Sex differences with gene expression;X-chromosome inactivation;Xist RNA;X Chromosome",NA,NA
"76","rayyan-902924748","Chromosomal and environmental contributions to sex differences in the vulnerability to neurological and neuropsychiatric disorders: Implications for therapeutic interventions",2022,9,12,"Prog Neurobiol","0301-0082",219,NA,"102353","Pallier, P. N. and Ferrara, M. and Romagnolo, F. and Ferretti, M. T. and Soreq, H. and Cerase, A.","",NA,NA,NA,"Neurological and neuropsychiatric disorders affect men and women differently. Multiple sclerosis, Alzheimer's disease, anxiety disorders, depression, meningiomas and late-onset schizophrenia affect women more frequently than men. By contrast, Parkinson's disease, autism spectrum condition, attention-deficit hyperactivity disorder, Tourette's syndrome, amyotrophic lateral sclerosis and early-onset schizophrenia are more prevalent in men. Women have been historically under-recruited or excluded from clinical trials, and most basic research uses male rodent cells or animals as disease models, rarely studying both sexes and factoring sex as a potential source of variation, resulting in a poor understanding of the underlying biological reasons for sex and gender differences in the development of such diseases. Putative pathophysiological contributors include hormones and epigenetics regulators but additional biological and non-biological influences may be at play. We review here the evidence for the underpinning role of the sex chromosome complement, X chromosome inactivation, and environmental and epigenetic regulators in sex differences in the vulnerability to brain disease. We conclude that there is a pressing need for a better understanding of the genetic, epigenetic and environmental mechanisms sustaining sex differences in such diseases, which is critical for developing a precision medicine approach based on sex-tailored prevention and treatment.","1873-5118 Pallier, Patrick N Ferrara, Maria Romagnolo, Francesca Ferretti, Maria Teresa Soreq, Hermona Cerase, Andrea Journal Article Review England 2022/09/14 Prog Neurobiol. 2022 Sep 12;219:102353. doi: 10.1016/j.pneurobio.2022.102353.","10.1016/j.pneurobio.2022.102353","Diet;Epigenetics;Gender medicine;Hormones;Inactive X chromosome (Xi);Mental disorders;Neuroinflammation;Neuropsychiatric diseases;Non-coding RNA regulators;Nutrition;Precision medicine;Schizophrenia;Sex chromosome complement;Stress;X chromosome inactivation (XCI);Sex Characteristics",NA,NA
"77","rayyan-902924749","Assessment of escape from X chromosome inactivation and gene expression in single human immune cells",2021,NA,NA,"STAR protocols","2666-1667",2,3,"100641","Hagen, S. H. and Hennesen, J. and Altfeld, M.","https://www.embase.com/search/results?subaction=viewrecord&id=L637578583&from=exporthttp://dx.doi.org/10.1016/j.xpro.2021.100641",NA,NA,NA,"X-chromosomal genes escaping from X chromosome inactivation (XCI) in immune cells can contribute to sex-specific differences in immune responses. This protocol describes the specific steps to determine escape from XCI and to simultaneously quantify mRNA expression of multiple genes at the single immune cell level using a single-nucleotide polymorphism approach. The protocol furthermore allows the analysis of allele-specific expression of X-chromosomal genes. For complete details on the use and execution of this protocol, please refer to Hagen et al. (2020).","L637578583 2022-03-29","10.1016/j.xpro.2021.100641","primer DNA;allele;cohort analysis;flow cytometry;gene expression;human;metabolism;mononuclear cell;procedures;single cell analysis;single nucleotide polymorphism;X chromosome inactivation;Humanities;Humanism;Humans;X Chromosome",NA,NA
"78","rayyan-902924750","X chromosome inactivation in the human placenta is patchy and distinct from adult tissues",2022,7,14,"HGG Adv","2666-2477",3,3,"100121","Phung, T. N. and Olney, K. C. and Pinto, B. J. and Silasi, M. and Perley, L. and O'Bryan, J. and Kliman, H. J. and Wilson, M. A.","",NA,NA,NA,"In humans, one of the X chromosomes in genetic females is inactivated by a process called X chromosome inactivation (XCI). Variation in XCI across the placenta may contribute to observed sex differences and variability in pregnancy outcomes. However, XCI has predominantly been studied in human adult tissues. Here, we sequenced and analyzed DNA and RNA from two locations from 30 full-term pregnancies. Implementing an allele-specific approach to examine XCI, we report evidence that XCI in the human placenta is patchy, with large patches of either maternal or paternal X chromosomes inactivated. Further, using similar measurements, we show that this is in contrast to adult tissues, which generally exhibit mosaic X inactivation, where bulk samples exhibit both maternal and paternal X chromosome expression. Further, by comparing skewed samples in placenta and adult tissues, we identify genes that are uniquely inactivated or expressed in the placenta compared with adult tissues, highlighting the need for tissue-specific maps of XCI.","2666-2477 Phung, Tanya N Olney, Kimberly C Pinto, Brendan J Silasi, Michelle Perley, Lauren O'Bryan, Jane Kliman, Harvey J Wilson, Melissa A Journal Article United States 2022/06/18 HGG Adv. 2022 May 23;3(3):100121. doi: 10.1016/j.xhgg.2022.100121. eCollection 2022 Jul 14.","10.1016/j.xhgg.2022.100121","Humanities;Humanism;Humans;X Chromosome;Placenta",NA,NA
"79","rayyan-902924751","YY1 binding association with sex-biased transcription revealed through X-linked transcript levels and allelic binding analyses",2016,NA,NA,"Scientific reports","2045-2322",6,NA,"37324","Chen, C. Y. and Shi, W. and Balaton, B. P. and Matthews, A. M. and Li, Y. and Arenillas, D. J. and Mathelier, A. and Itoh, M. and Kawaji, H. and Lassmann, T. and Hayashizaki, Y. and Carninci, P. and Forrest, A. R. and Brown, C. J. and Wasserman, W. W.","https://www.embase.com/search/results?subaction=viewrecord&id=L622294043&from=exporthttp://dx.doi.org/10.1038/srep37324",NA,NA,NA,"Sex differences in susceptibility and progression have been reported in numerous diseases. Female cells have two copies of the X chromosome with X-chromosome inactivation imparting mono-allelic gene silencing for dosage compensation. However, a subset of genes, named escapees, escape silencing and are transcribed bi-allelically resulting in sexual dimorphism. Here we conducted in silico analyses of the sexes using human datasets to gain perspectives into such regulation. We identified transcription start sites of escapees (escTSSs) based on higher transcription levels in female cells using FANTOM5 CAGE data. Significant over-representations of YY1 transcription factor binding motif and ChIP-seq peaks around escTSSs highlighted its positive association with escapees. Furthermore, YY1 occupancy is significantly biased towards the inactive X (Xi) at long non-coding RNA loci that are frequent contacts of Xi-specific superloops. Our study suggests a role for YY1 in transcriptional activity on Xi in general through sequence-specific binding, and its involvement at superloop anchors.","L622294043 2018-05-29","10.1038/srep37324","long untranslated RNA;protein binding;transcription factor YY1;XIST non-coding RNA;allele;allelic imbalance;binding site;cell line;computer simulation;female;genetic transcription;genetics;human;male;metabolism;sex factor;transcription initiation site;X chromosomal inheritance;X chromosome inactivation;Alleles;Bias (Epidemiology)",NA,NA
"80","rayyan-902924752","Characterization of the promoter region of the mouse Xist gene",1995,NA,NA,"Proceedings of the National Academy of Sciences of the United States of America","0027-8424",92,26,"12515-12519","Pillet, N. and Bonny, C. and Schorderet, D. F.","https://www.embase.com/search/results?subaction=viewrecord&id=L26014100&from=exporthttp://dx.doi.org/10.1073/pnas.92.26.12515",NA,NA,NA,"The mouse Xist gene is expressed exclusively from the inactive X chromosome and may be implicated in initiating X inactivation. To better understand the mechanisms underlying the control of Xist expression, we investigated the upstream regulatory region of the mouse Xist promoter. A 1.2-kb upstream region of the Xist gene was sequenced and promoter activity was studied by chloramphenicol acetyltransferase (CAT) assays after transfection in murine XX and XY cell lines. The region analyzed (-1157 to +917) showed no in vitro sex-specific promoter activity. However, a minimal constitutional promoter was assigned to a region from -81 to +1, and a cis element from -41 to -15 regulates promoter activity. We showed that a nuclear factor binds to an element located at -30 to -25 (TTAAAG). A second sequence at -41 to -15 does not act as an enhancer and is unable to confer transcriptional activity to the Xist gene on its own. A third region from - 82 to -41 is needed for correct expression. Deletion of the segment -441 to - 231 is associated with an increase in CAT activity and may represent a silencer element.","L26014100 1996-01-22","10.1073/pnas.92.26.12515","animal cell;article;gene control;gene expression regulation;gene mapping;gene repression;mouse;nonhuman;priority journal;promoter region;transcription regulation;X chromosome;Mice;Promoter Regions, Genetic",NA,NA
"81","rayyan-902924753","Sexual congruency in the connectome and translatome of VTA dopamine neurons",2017,NA,NA,"Scientific reports","2045-2322",7,1,"11120","Chung, A. S. and Miller, S. M. and Sun, Y. and Xu, X. and Zweifel, L. S.","https://www.embase.com/search/results?subaction=viewrecord&id=L627194903&from=exporthttp://dx.doi.org/10.1038/s41598-017-11478-5",NA,NA,NA,"The ventral tegmental area (VTA) dopamine system is important for reward, motivation, emotion, learning, and memory. Dysfunctions in the dopamine system are linked to multiple neurological and neuropsychiatric disorders, many of which present with sex differences. Little is known about the extent of heterogeneity in the basic organization of VTA dopamine neurons with regard to sex. Here, we characterized the cell-specific connectivity of VTA dopamine neurons, their mRNA translational profile, and basic electrophysiological characteristics in a common strain of mice. We found no major differences in these metrics, except for differential expression of a Y-chromosome associated mRNA transcript, Eif2s3y, and the X-linked, X-inactivation transcript Xist. Of note, Xist transcript was significantly enriched in dopamine neurons, suggesting tight regulation of X-linked gene expression to ensure sexual congruency. These data indicate that the features that make dopamine neurons unique are highly concordant and not a principal source of sexual dimorphism.","L627194903 2019-04-18 2019-07-05","10.1038/s41598-017-11478-5","biological marker;animal;biology;connectome;dopaminergic nerve cell;electrophysiology;female;fluorescent antibody technique;gene expression profiling;immunohistochemistry;male;metabolism;mouse;physiology;sex factor;transgenic mouse;ventral tegmentum;Dopamine",NA,NA
"82","rayyan-902924754","Early X chromosome inactivation during human preimplantation development revealed by single-cell RNA-sequencing",2017,NA,NA,"Scientific reports","2045-2322",7,1,"10794","Moreira de Mello, J. C. and Fernandes, G. R. and Vibranovski, M. D. and Pereira, L. V.","https://www.embase.com/search/results?subaction=viewrecord&id=L626197881&from=exporthttp://dx.doi.org/10.1038/s41598-017-11044-z",NA,NA,NA,"In female mammals, one X chromosome is transcriptionally inactivated (XCI), leading to dosage compensation between sexes, fundamental for embryo viability. A previous study using single-cell RNA-sequencing (scRNA-seq) data proposed that female human preimplantation embryos achieve dosage compensation by downregulating both Xs, a phenomenon named dampening of X expression. Using a novel pipeline on those data, we identified a decrease in the proportion of biallelically expressed X-linked genes during development, consistent with XCI. Moreover, we show that while the expression sum of biallelically expressed X-linked genes decreases with embryonic development, their median expression remains constant, rejecting the hypothesis of X dampening. In addition, analyses of a different dataset of scRNA-seq suggest the appearance of X-linked monoallelic expression by the late blastocyst stage in females, another hallmark of initiation of XCI. Finally, we addressed the issue of dosage compensation between the single active X and autosomes in males and females for the first time during human preimplantation development, showing emergence of X to autosome dosage compensation by the upregulation of the active X chromosome in both male and female embryonic stem cells. Our results show compelling evidence of an early process of X chromosome inactivation during human preimplantation development.","L626197881 2019-02-08 2019-06-07","10.1038/s41598-017-11044-z","allele;biology;blastocyst;embryo development;female;gene expression;gene expression profiling;genetic database;genetics;high throughput sequencing;human;male;mammalian embryo;metabolism;molecular genetics;procedures;sex factor;single cell analysis;single nucleotide polymorphism;X chromosomal inheritance;X chromosome inactivation;Humanities;Humanism;Humans;Base Sequence",NA,NA
