"","key","title","year","month","day","journal","issn","volume","issue","pages","authors","url","language","publisher","location","abstract","notes","doi","keywords","pubmed_id","pmc_id"
"585","rayyan-902925257","Sex and gender differences in the causes of dementia: A narrative review",2014,NA,NA,"Maturitas","1873-4111 0378-5122",79,2,"196-201","Rocca, W. A. and Mielke, M. M. and Vemuri, P. and Miller, V. M.","https://www.embase.com/search/results?subaction=viewrecord&id=L53198206&from=exporthttp://dx.doi.org/10.1016/j.maturitas.2014.05.008",NA,NA,NA,"This is a narrative review of new ideas and concepts related to differences between men and women in their risk of developing dementia or Alzheimer's disease (AD). We introduce the concept of dimorphic neurology and the distinction between sex and gender. We then provide three examples of risk factors related to sex and gender from the literature. Apolipoprotein E genotype is equally common in men and women but has a stronger effect in women. Apolipoprotein E genotype is a biological factor that cannot be modified but interacts with sex or gender related factors that can be modified. Low education has a similar harmful effect in men and women but has been historically more common in women. Education is a social factor related to gender that can be modified. Finally, bilateral oophorectomy is a factor restricted to women. Bilateral oophorectomy is a surgical practice related to sex that can be modified. Consideration of risk and protective factors in men and women separately may accelerate etiologic research for neurological diseases in general, and for dementia and AD in particular. Similarly, future preventive interventions for dementia should be tailored to men and women separately.","L53198206 2014-06-26 2014-12-23","10.1016/j.maturitas.2014.05.008","apolipoprotein E;low density lipoprotein receptor related protein;Alzheimer disease;decision making;dementia;drinking behavior;education;episodic memory;estrogen therapy;genetic association;genotype;human;hysterectomy;leisure;mild cognitive impairment;nerve cell culture;neurite outgrowth;nerve regeneration;neurologic disease;nonhuman;ovariectomy;personal experience;physical activity;physical education;review;risk factor;semantic memory;sex chromosome;sex difference;single nucleotide polymorphism;smoking;social aspect;X chromosome;X chromosome inactivation;Y chromosome;Dementia",NA,NA
"586","rayyan-902925258","Homozygous Tsix mutant mice reveal a sex-ratio distortion and revert to random X-inactivation",2002,9,NA,"Nat Genet","1061-4036 (Print) 1061-4036",32,1,"195-200","Lee, J. T.","",NA,NA,NA,"Tsix controls X-chromosome inactivation (XCI) by blocking the accumulation of Xist RNA on the future active X chromosome. Deleting Tsix on one X chromosome (X(Delta)X) skews XCI toward the mutated X chromosome in the female soma. Here I have generated homozygous Tsix-null mice (X(Delta)X(Delta)) to test how deleting the second allele affects the choice of XCI. Homozygosity leads to extremely low fertility and reveals two previously unknown non-mendelian patterns of inheritance. First, the sex ratio is skewed against female births so that one daughter is born for every two to three sons. Second, the pattern of XCI unexpectedly returns to random in surviving X(Delta)X(Delta) mice. Thus, with respect to choice, mutation of Tsix yields a phenotypic abnormality in heterozygotes but not homozygotes. To reconcile the paradox of female loss with apparent reversion to random choice, I propose that deleting both Tsix alleles results in chaotic choice and that randomness in X(Delta)X(Delta) survivors reflects a fortuitous selection of distinct X chromosomes as active and inactive.","Lee, Jeannie T Journal Article Research Support, Non-U.S. Gov't Research Support, U.S. Gov't, P.H.S. United States 2002/07/30 Nat Genet. 2002 Sep;32(1):195-200. doi: 10.1038/ng939. Epub 2002 Jul 29.","10.1038/ng939","Animals;Crosses, Genetic;*Dosage Compensation, Genetic;Female;Homozygote;Male;Mice;Mice, Inbred C57BL;Mutation;RNA, Antisense;RNA, Long Noncoding;RNA, Untranslated;*Sex Ratio;Transcription Factors/*genetics/physiology;Trophoblasts/pathology;X Chromosome;Sex Ratio",NA,NA
"587","rayyan-902925259","Sexual dimorphism in interferon-tau production by in vivo-derived bovine embryos",2004,2,NA,"Molecular Reproduction and Development","1040-452X 1098-2795 J9 - MOL REPROD DEV",67,2,"193-199","Kimura, K. and Spate, L. D. and Green, M. P. and Murphy, C. N. and Seidel, G. E. and Roberts, R. M.","",NA,NA,NA,"Interferon-tau (IFN-tau) is an antiluteolytic factor responsible for preventing regression of the maternal corpus luteum (CL) during early pregnancy of cattle. In vitro-produced (IVP) bovine embryos first produce IFN-tau as blastocysts. In the present study, we have examined whether sexually dimorphic production of IFN-tau, which is observed among IVP blastocysts, also occurs among in vivo-produced blastocysts, and whether this difference between the sexes persists to day 14 when silencing of one of the X-chromosomes in the trophectoderm is complete. Embryos were flushed from cattle that had been superovulated and bred by AI. Blastocysts (63 male, 62 female) recovered between days 8.5 and 9.5 of pregnancy, were cultured individually. No differences were observed between males and females in either their developmental stage or quality at the beginning, during, and at the end of culture. Female embryos produced more IFN-tau than males by 24 hr (mean values, males: 16.6 +/- 3.7, females: 49.4 +/- 9.0 pg per embryo; P < 0.05) and 48 hr (male: 189.8 +/- 37, 1, female: 410.9 +/- 66.6 pg per embryo; P<0.05). However, the variability in IFN-tau production between individual blastocysts was so great that IFN-tau secretion is unlikely to be of value as a non-invasive means to predict embryo sex. When conceptuses were recovered at day 14, elongating males (n = 25) and females (n = 24) were similar in dimension and did not differ in their IFN-tau production after 4.5 hr (male: 2,550 +/- 607, female: 2,376 +/- 772 ng per conceptus) and 24 hr (male: 12,056 +/- 2,438, female: 8,447 +/- 1,630 ng per conceptus) of culture. Thus, sexual dimorphism in IFN-tau production is observed in both IVP and in vivo-produced expanded blastocysts, but is lost by day 14 of in vivo development. (C) 2004 Wiley-Liss, Inc.","Times Cited in Web of Science Core Collection: 54 Total Times Cited: 56 Cited Reference Count: 51","10.1002/mrd.10389","bovine;IFN-tau;in vivo-produced embryos;sexual dimorphism;X-chromosome inactivation;DEVELOPMENTALLY IMPORTANT GENES;Interferons",NA,NA
"588","rayyan-902925260","X-inactivation of the Sts locus in the mouse: an anomaly of the dosage compensation mechanism",1989,6,NA,"Genet Res","0016-6723",53,3,"193-199","Jones, J. and Peters, J. and Rasberry, C. and Cattanach, B. M.","",NA,NA,NA,"The behaviour of the X- and Y-borne Sts locus has been studied in male and female mice. There was considerable heterogeneity in STS activity between inbred mouse strains, with a four fold difference in activity between the highest (101/H) and lowest (Ju/Ct) activity strains, which can be interpreted in terms of allelic differences. In all inbred strains male STS levels were higher than those of female STS levels and in the majority of strains tested male STS levels were nearly twice as high as female levels. Reciprocal crosses between C3H/HeH and the STS-deficient substrain, C3H/An, demonstrated that activities of the X- and Y-borne genes in males are essentially the same and this suggested that the lower STS level in females derives from X-inactivation of the locus. The possibility that hormonal differences could instead be responsible for the lower activity in females was ruled out by the findings that (a) castration of males did not reduce their STS levels and (b) sex-reversed males, X/X Sxr, had STS levels typical of females. Final proof that the mouse Sts locus can be subject to the X-inactivation process was provided by the observation that XX females had STS levels that were only slightly (20%) higher than those of XO females. The difference may indicate incomplete inactivation of the locus. Linkage data verifying the location of Sts on the distal end of the X chromosome are provided.(ABSTRACT TRUNCATED AT 250 WORDS)","Jones, J Peters, J Rasberry, C Cattanach, B M Journal Article England 1989/06/01 Genet Res. 1989 Jun;53(3):193-9. doi: 10.1017/s0016672300028160.","10.1017/s0016672300028160","Animals;Arylsulfatases/*genetics;Crosses, Genetic;*Dosage Compensation, Genetic;Female;Male;Mice;Mice, Inbred Strains;Sex Factors;Species Specificity;Steryl-Sulfatase;Sulfatases/*genetics;X Chromosome Inactivation",NA,NA
"589","rayyan-902925261","Sex-dependent insulin like growth factor-1 expression in preattachment equine embryos",2013,1,1,"Theriogenology","0093-691X 1879-3231 J9 - THERIOGENOLOGY",79,1,"193-199","Beckelmann, J. and Budik, S. and Helmreich, M. and Palm, E. and Walter, I. and Aurich, C.","",NA,NA,NA,"An adjustment of sex ratio of offspring to the conditions present at conception is seen in many mammals including horses. This depends on preferential survival of male embryos under conditions of high energy intake. In several species, growth factors including insulin like growth factor (IGF)-1 have been shown to promote embryonic development by decreasing apoptosis and increasing cell proliferation. We hypothesized that sex-related differences in IGF-1 expression in equine embryos during the phase of maternal recognition of pregnancy might exist and thus contribute to preferential survival of embryos from either of both sexes under specific environmental conditions. Insulin like growth factor-1 mRNA expression of in vivo-produced equine embryos on different days of pregnancy (Day 8, N = 6; Day 10, N = 8; Day 12, N = 14) was analyzed. Insulin like growth factor-1 mRNA expression was evaluated by reverse transcription quantitative polymerase chain reaction. The sex of the embryo was determined by detection of X-inactivation specific transcript (Xist) RNA and equine sex determining region of the Y chromosome DNA. Embryos positive for Xist expression were classified as female, and Xist negative and equine sex determining region of the Y chromosome positive embryos were classified as male. From 28 embryos tested, 15 (54%) showed positive Xist expression and were thus classified as female. Insulin like growth factor-1 mRNA expression was influenced by sex (P = 0.01) but not by day of pregnancy (relative expression of IGF-1 in relation to beta-actin, Day 8: male 5.1 +/- 2.1, female 11.4; Day 10: male 5.2 +/- 1.6, female 17.4 +/- 6.7; Day 12: male 2.6 +/- 0.3, female 11.6 +/- 2.4). Results demonstrate an increased expression of IGF-1 in female equine embryos. Sex-related influences on expression of the IGF system are probably related to a gradual X chromosome inactivation. (C) 2013 Elsevier Inc. All rights reserved.","Times Cited in Web of Science Core Collection: 9 Total Times Cited: 9 Cited Reference Count: 56","10.1016/j.theriogenology.2012.10.004","Horse;Embryo;IGF-1;Sex difference;X-CHROMOSOME INACTIVATION;DEER CERVUS-ELAPHUS;BOVINE EMBRYOS;IGF-I;BLASTOCYST DEVELOPMENT;STIMULATES GROWTH;SUBFERTILE MARES;RECIPIENT MARES;XIST EXPRESSION;RATIO;Insulin-Like Growth Factor I;Somatomedins",NA,NA
"590","rayyan-902925262","Evolution of mammalian sex chromosomes and sex-determining genes",1994,NA,NA,"International Review of Cytology","0074-7696",154,NA,"191-259","Graves, J. A. M. and Foster, J. W.","https://www.embase.com/search/results?subaction=viewrecord&id=L25224665&from=export",NA,NA,NA,"","L25224665 1995-08-08","","testis determining factor;chromosome structure;cytology;evolution;gene expression;gene function;gene location;gonad development;hormone action;human;in situ hybridization;karyotype;marsupial;molecular cloning;nonhuman;priority journal;review;sex chromosome;sex determination;sex difference;testis development;X chromosome;X chromosome inactivation;X chromosome linkage;Y chromosome;Sex Chromosomes",NA,NA
"591","rayyan-902925263","Nature's Curiosities - Bilateral Gynandromorphism in Mice",2022,NA,NA,"Laboratory Animals","1758-1117",56,1,"191","Klein, B. and Terwort, N. and Kersebom, A. and Ehmcke, J. and Schlatt, S. and Wistuba, J.","https://www.embase.com/search/results?subaction=viewrecord&id=L638582808&from=exporthttp://dx.doi.org/10.1177/00236772221103950",NA,NA,NA,"This case report summarises the topic of a male C57BL/6 mouse delivered from a commercial vendor reported with an enlarged scrotal area. At visual and palpatory inspection, ambigous sex characteristics were observed. Briefly, neither testes nor a vaginal opening was detected. During diagnostic section, a small penis, a left-sided testis, epididymis, and vas deferens, as well as a rightsided ovary, fallopian tube, and enlarged uterine horn were detected. Organs were processed for histological evaluation of gonadal status. Briefly, male as well as female reproductive organs were developed physiologically. Spermatogenesis was found to be qualitatively normal but quantitatively substantially reduced. The ovary presented follicle-like structures. For determination of the chromosomal sex, X-inactivation was assessed by Xist expression. Xist expression was found to be negative, suggesting an XY karyotype for the gynandromorphic mouse. Gynandromorphism is an overall extremely rare finding mostly observed in insects, spiders, crustaceans, other arthropods, and birds. Bilateral gynandromorphism further specifies a midline seperation of male vs female characteristics, as observed for the internal genitalia in the mouse presented here. We suggest that the loss of the Y-chromosom in one cell of an XY two-cell stage, consequently leading to XY i.e. male and X0 i.e. female cell progeny during cell division, might offer a possible explanation for the bilateral development of functional reproductive organs of both XY and X0 origin in the present gynandromorphic mouse..","L638582808 2022-08-02","10.1177/00236772221103950","adult;animal experiment;arthropod;bird;cell division;conference abstract;Crustacea;epididymis;Fallopian tube;female;female genital system;histology;insect;karyotype 46,XY;male;mouse;nonhuman;ovary follicle;penis;sexual characteristics;spermatogenesis;spider;testis;uterus horn;vagina;vas deferens;X chromosome inactivation;Mice",NA,NA
"592","rayyan-902925264","Chromosome-wide DNA methylation analysis predicts human tissue-specific X inactivation",2011,NA,NA,"Human Genetics","0340-6717 1432-1203",130,2,"187-201","Cotton, A. M. and Lam, L. and Affleck, J. G. and Wilson, I. M. and Peñaherrera, M. S. and McFadden, D. E. and Kobor, M. S. and Lam, W. L. and Robinson, W. P. and Brown, C. J.","https://www.embase.com/search/results?subaction=viewrecord&id=L51434578&from=exporthttp://dx.doi.org/10.1007/s00439-011-1007-8",NA,NA,NA,"X-chromosome inactivation (XCI) results in the differential marking of the active and inactive X with epigenetic modifications including DNA methylation. Consistent with the previous studies showing that CpG island-containing promoters of genes subject to XCI are approximately 50% methylated in females and unmethylated in males while genes which escape XCI are unmethylated in both sexes; our chromosome-wide (Methylated DNA ImmunoPrecipitation) and promoter-targeted methylation analyses (Illumina Infinium HumanMethylation27 array) showed the largest methylation difference (D = 0.12, p < 2.2 E-16) between male and female blood at X-linked CpG islands promoters. We used the methylation differences between males and females to predict XCI statuses in blood and found that 81% had the same XCI status as previously determined using expression data. Most genes (83%) showed the same XCI status across tissues (blood, fetal: muscle, kidney and nerual); however, the methylation of a subset of genes predicted different XCI statuses in different tissues. Using previously published expression data the effect of transcription on gene-body methylation was investigated and while X-linked introns of highly expressed genes were more methylated than the introns of lowly expressed genes, exonic methylation did not differ based on expression level. We conclude that the XCI status predicted using methylation of X-linked promoters with CpG islands was usually the same as determined by expression analysis and that 12% of X-linked genes examined show tissue-specific XCI whereby a gene has a different XCI status in at least one of the four tissues examined. © 2011 The Author(s).","L51434578 2011-05-23 2011-08-12","10.1007/s00439-011-1007-8","article;autosome;brain tissue;CpG island;density;DNA methylation;exon;female;fetus (anatomy);gene expression;genetic transcription;human;human cell;human tissue;intron;kidney parenchyma;major clinical study;male;muscle tissue;nervous tissue;peripheral blood mononuclear cell;priority journal;sex difference;X chromosome;X chromosome inactivation;Humanities;Humanism;Humans;DNA (Cytosine-5-)-Methyltransferase;Organ Specificity;Methylation",NA,NA
"593","rayyan-902925265","The nature of quantitative genetic variation in Drosophila. III. Mechanism of dosage compensation for sex-linked abdominal bristle polygenes",1977,1,NA,"Genetics","0016-6731 (Print) 0016-6731",85,1,"185-191","Frankham, R.","",NA,NA,NA,"Seventeen lines, each homozygous for a different X chromosome but all with a common autosomal genetic blackground, were constructed and assayed for abdominal bristle number to determine whether dosage compensation operates for sex-linked genes affecting this character. --The regression coefficient of male mean on female mean using a logarithmic scale was 0.90 +/- 0.13 and the genetic regression coefficient 0.92, neither differing significantly from unity. The genetic components of variance in males and females were also very similar (0.000234 or 0.000228, respectively). These results indicate that dosage compensation is complete (or nearly so) for sex-linked genes affecting this character. The bristle scores of females did not differ in reciprocal crosses between these lines, thus dosage compensation does not operate by paternal X inactivation. --The question of an adequate scale for abdominal bristle number had to be examined during the study. A logarithmic scale appeared to be adequate for both genotypic and environmental differences.","Frankham, R Journal Article United States 1977/01/01 Genetics. 1977 Jan;85(1):185-91. doi: 10.1093/genetics/85.1.185.","10.1093/genetics/85.1.185","Animals;Crosses, Genetic;*Drosophila;Female;*Genes;*Genetic Linkage;*Genetic Variation;Hair;Homozygote;Male;*Sex Chromosomes;Sex Factors;Genetic Variation",NA,NA
"594","rayyan-902925266","Amelogenin dosage compensation in carcinoma of colon, lung, liver and kidney, is not a marker of clonality in males",1998,8,NA,"Mol Cell Probes","0890-8508 (Print) 0890-8508",12,4,"185-190","Zvejnieks, P. A. and Tellschow, S. R. and Gudlaugsson, E. G. and Markham, N. and Shroyer, K. R.","",NA,NA,NA,"The analysis of patterns of X-chromosome inactivation is becoming increasingly utilized as a marker of clonal composition of tissues from women. To date, however, no analogous system has been found for the study of clonality in tissue from men. In the current study, the methylation patterns for portions of the amelogenin genes are tested, which are encoded on both the X- and Y-chromosome (AMGX and AMGY). The polymerase chain reaction (PCR) was used to amplify portions of AMGX and AMGY from genomic DNA of carcinomas of the colon, lung, liver and kidney, as well as from matched normal somatic tissues. The amplification target included Alu I methylation sensitive restriction endonuclease sites as well as a 189 bp sequence which is present in AMGX but is absent in AMGY. Polymerase chain reaction amplification of AMGX and AMGY was successful using genomic DNA from both tumour and normal control tissue in 24 of the 26 cases. Pretreatment of genomic DNA with Alu I blocked amplification of AMGX in all cases from both normal tissue and tumour. This indicates that AMGX and AMGY undergo a non-random pattern of methylation in both normal tissues and in tumours, precluding their use as a marker of clonality. Methylation of Alu I sites in AMGY suggests that the amelogenin genes undergo dosage compensation, which raises the possibility that the expression of amelogenin is not restricted to the development of the tooth bud but may also play some other role in various tissues of the body.","Zvejnieks, P A Tellschow, S R Gudlaugsson, E G Markham, N Shroyer, K R 1 R55 CA60830-01/CA/NCI NIH HHS/United States Journal Article Research Support, U.S. Gov't, P.H.S. England 1998/09/04 Mol Cell Probes. 1998 Aug;12(4):185-90. doi: 10.1006/mcpr.1998.0172.","10.1006/mcpr.1998.0172","Adenocarcinoma/genetics;Adult;Aged;Aged, 80 and over;Amelogenin;Biomarkers;Carcinoma, Hepatocellular/genetics;Carcinoma, Renal Cell/genetics;Carcinoma, Small Cell/genetics;Clone Cells/pathology;Colonic Neoplasms/*genetics;Dental Enamel Proteins/*genetics;*Dosage Compensation, Genetic;Humans;Kidney Neoplasms/*genetics;Liver Neoplasms/*genetics;Lung Neoplasms/*genetics;Male;Middle Aged;Sex Factors;Kidney;Liver;Lung",NA,NA
"595","rayyan-902925267","Cardiovascular diseases, aging, and the gender gap in human longevity",2007,NA,NA,"Journal of the American Society of Hypertension","1933-1711",1,3,"185-188","Aviv, A.","https://www.embase.com/search/results?subaction=viewrecord&id=L46780271&from=exporthttp://dx.doi.org/10.1016/j.jash.2007.02.002",NA,NA,NA,"This study probes the biological meaning of the gender gap in longevity and its possible ramifications for the expression of cardiovascular diseases in human beings. It addresses the potential role of estrogen and the X chromosome in the longer life span of women than men in modern societies. In addition, it links features of the reproductive and post-reproductive periods with cardiovascular diseases and longevity in women. © 2007 American Society of Hypertension.","L46780271 2007-05-01","10.1016/j.jash.2007.02.002","estrogen;free radical;nitric oxide;steroid hormone;aging;cardiovascular disease;chromosome mosaicism;female;human;lifespan;longevity;male;menopause;oxidative stress;parity;pleiotropy;preeclampsia;prematurity;priority journal;reproduction;review;sex difference;small for date infant;spontaneous abortion;vasodilatation;X chromosome;X chromosome inactivation;Humanities;Humanism;Humans;Cardiovascular Diseases",NA,NA
"596","rayyan-902925268","Prenatal sex differentiation: genetic and hormonal control",1974,NA,NA,"Acta Endocrinologica","0001-5598",75,NA,"185-186","Lenz, W.","https://www.embase.com/search/results?subaction=viewrecord&id=L4202020&from=export",NA,NA,NA,"The differentiation of a testicle depends on the presence of the Y chromosome. The role of the second X chromosome in the female sex is less clear. Many, possibly most, genes on the second X chromosome are inactivated by the lyonization mechanism. It is obvious, however, that part of the second X chromosome escapes complete inactivation at least during certain periods or in certain cells. Otherwise, there would be no difference between XO females and XX females or between XY males and XXY males. The origin of the ovary is independent from the second X. Ovaries develop at the same time both in normal XX females and in XO females. In the latter, however, ovarian degeneration begins towards the end of pregnancy. There are conspicuous effects of the second X on survival, growth and form. Less than 5% of XO embryos will survive to term. Those surviving are small for date babies with severely retarded postnatal growth and increased postnatal mortality. Neither a comparably high mortality nor growth retardation are seen in the autosomal recessive or possible X linked types of pure gonadal dysgenesis. They must, therefore, in some way be related to the lack of the second X. The better chances of survival of normal females as compared to males may in part be due to a similar mechanism. X linked recessive genes, though present in about twice as many males, are regularly manifested in males, but only exceptionally in females. This mechanism causes a higher mortality of some males rather than a generally higher mortality of the male. A quite impressive list of X linked conditions can be drawn up which may cause death between birth and early adult age. Some examples are given.","L4202020 1974-01-01","","hormone;sex hormone;age;developmental biology;embryo;embryo development;embryo growth;fetus;gene control;genetics;gonad;newborn;normal human;ovary;perinatal mortality;pregnancy;puberty;sex difference;sex differentiation;testis;X chromosome;Y chromosome",NA,NA
