"","key","title","year","month","day","journal","issn","volume","issue","pages","authors","url","language","publisher","location","abstract","notes","doi","keywords","pubmed_id","pmc_id"
"178","rayyan-902924850","Tissue-specific distribution of an alternatively spliced COL4A5 isoform and non-random X chromosome inactivation reflect phenotypic variation in heterozygous X-linked Alport syndrome",2006,NA,NA,"Nephrology Dialysis Transplantation","0931-0509 1460-2385",21,6,"1582-1587","Shimizu, Y. and Nagata, M. and Usui, J. and Hirayama, K. and Yoh, K. and Yamagata, K. and Kobayashi, M. and Koyama, A.","https://www.embase.com/search/results?subaction=viewrecord&id=L44063128&from=exporthttp://dx.doi.org/10.1093/ndt/gfl051",NA,NA,NA,"A novel type of hereditary transmission of COL4A5 in a Japanese family with X-linked Alport syndrome was detected through analysis of cDNA sequences and an X-chromosome inactivation assay. A female patient with moderately altered renal function, who was diagnosed with Alport syndrome by renal biopsy, and her mother, who was undergoing maintenance haemodialysis, showed similar tissue-specific expression of a truncated isoform of COL4A5, which was generated by alternative splicing without a splice-site mutation. Expression of the truncated isoform occurred in the renal specimen derived from the patient, but not in specimens from controls. Genomic analysis revealed two point mutations (c.4821 + 121, T>C; c.4822-151_150, ins T) in intron 49 of COL4A5 from the patient. The peripheral blood mononuclear cells of the patient and her mother showed non-random lyonization. While the females showed only renal impairment, an affected male in the same family suffered from severe renal insufficiency, visual defect and hearing disturbances. Hence, we suggest that this type of heredity COL4A5 presents with phenotypic variation in female heterozygous X-linked Alport syndrome patients. © 2006 Oxford University Press.","L44063128 2006-08-09","10.1093/ndt/gfl051","collagen type 4;complementary DNA;isoprotein;adult;Alport syndrome;alternative RNA splicing;article;bioassay;case report;controlled study;disease severity;disease transmission;DNA sequence;female;gene mutation;genetic variability;genome analysis;hearing impairment;hemodialysis;heterozygosity;human;human cell;human tissue;Japan;kidney biopsy;male;nucleotide sequence;peripheral blood mononuclear cell;phenotype;priority journal;protein expression;protein localization;sequence analysis;sex difference;tissue distribution;tissue specificity;visual disorder;X chromosome inactivation;X chromosome linkage;Organ Specificity;Nephritis, Hereditary;X Chromosome;Phenotype",NA,NA
"179","rayyan-902924851","X-linked severe combined immunodeficiency. Diagnosis in males with sporadic severe combined immunodeficiency and clarification of clinical findings",1990,5,NA,"J Clin Invest","0021-9738 (Print) 0021-9738",85,5,"1548-1554","Conley, M. E. and Buckley, R. H. and Hong, R. and Guerra-Hanson, C. and Roifman, C. M. and Brochstein, J. A. and Pahwa, S. and Puck, J. M.","",NA,NA,NA,"Over 80% of infants with severe combined immunodeficiency (SCID) of unknown genetic etiology are males, yet less than a third of these affected males have a family history of X-linked disease. To help identify new mutations of the X-linked SCID gene and to provide genetic counseling, X chromosome inactivation patterns in T cells from 16 women who had sons with sporadic SCID were examined. Between 9 and 35 human/hamster hybrids that selectively retained the active human X chromosome were produced from the T cells of each woman and analyzed with an X-linked restriction fragment length polymorphism for which the woman in question was heterozygous. Exclusive use of a single X as the active X was seen in the T cell hybrids from 7 of the 16 women, identifying these women as carriers of X-linked SCID. Studies on additional family members confirmed the mutant nature of the inactive X and revealed the source of the new mutation in three families. To determine whether there were any laboratory characteristics that might differentiate the boys whose mothers were identified as carriers of X-linked SCID from those whose mothers were not, the clinical records of both groups were compared to each other and to a group of 14 boys with a family history of X-linked SCID. The most consistent finding in the 21 patients with X-linked SCID was an elevated proportion of B cells. These data demonstrate the high incidence of spontaneous mutation for the X-linked SCID gene and help clarify the characteristic presenting features of this disorder.","Conley, M E Buckley, R H Hong, R Guerra-Hanson, C Roifman, C M Brochstein, J A Pahwa, S Puck, J M","10.1172/jci114603","B-Lymphocytes/immunology;Cells, Cultured;DNA/blood/genetics;DNA Probes;Female;Humans;Hybrid Cells/immunology;Immunologic Deficiency Syndromes/*genetics;Male;Mutation;Sex Factors;T-Lymphocytes/immunology;*X Chromosome;Severe Combined Immunodeficiency;X-Linked Combined Immunodeficiency Diseases",NA,NA
"180","rayyan-902924852","X Chromosome Dosage Influences DNA Methylation Dynamics during Reprogramming to Mouse iPSCs",2018,NA,NA,"Stem Cell Reports","2213-6711",10,5,"1537-1550","Pasque, V. and Karnik, R. and Chronis, C. and Petrella, P. and Langerman, J. and Bonora, G. and Song, J. and Vanheer, L. and Sadhu Dimashkie, A. and Meissner, A. and Plath, K.","https://www.embase.com/search/results?subaction=viewrecord&id=L2000659476&from=exporthttp://dx.doi.org/10.1016/j.stemcr.2018.03.019",NA,NA,NA,"A dramatic difference in global DNA methylation between male and female cells characterizes mouse embryonic stem cells (ESCs), unlike somatic cells. We analyzed DNA methylation changes during reprogramming of male and female somatic cells and in resulting induced pluripotent stem cells (iPSCs). At an intermediate reprogramming stage, somatic and pluripotency enhancers are targeted for partial methylation and demethylation. Demethylation within pluripotency enhancers often occurs at ESC binding sites of pluripotency transcription factors. Late in reprogramming, global hypomethylation is induced in a female-specific manner. Genome-wide hypomethylation in female cells affects many genomic landmarks, including enhancers and imprint control regions, and accompanies the reactivation of the inactive X chromosome. The loss of one of the two X chromosomes in propagating female iPSCs is associated with genome-wide methylation gain. Collectively, our findings highlight the dynamic regulation of DNA methylation at enhancers during reprogramming and reveal that X chromosome dosage dictates global DNA methylation levels in iPSCs. Somatic cells can be reprogrammed to iPSCs, inducing reactivation of the inactive X chromosome. Using genome-scale DNA methylation analyses, Plath, Pasque, and colleagues show that iPSCs adopt sex-specific differences in global DNA methylation that correlate with the presence of two active X chromosomes. Upon culture, female iPSCs lose one of the two X chromosomes and adopt male-like DNA methylation.","L2000659476 2018-04-23 2018-06-14","10.1016/j.stemcr.2018.03.019","DNA;transcription factor;animal cell;article;binding site;DNA demethylation;DNA methylation;embryo;enhancer region;female;genome imprinting;induced pluripotent stem cell;male;mouse;mouse embryonic stem cell;nonhuman;nuclear reprogramming;priority journal;somatic cell;X chromosome;X chromosome inactivation;DNA (Cytosine-5-)-Methyltransferase;X Chromosome",NA,NA
"181","rayyan-902924853","SMC1A expression and mechanism of pathogenicity in probands with X-linked Cornelia de Lange Syndrome",2009,NA,NA,"Human Mutation","1059-7794",30,11,"1535-1542","Liu, J. and Feldman, R. and Zhang, Z. and Deardorff, M. A. and Haverfield, E. V. and Kaur, M. and Li, J. R. and Clark, D. and Kline, A. D. and Waggoner, D. J. and Das, S. and Jackson, L. G. and Krantz, I. D.","https://www.embase.com/search/results?subaction=viewrecord&id=L355564733&from=exporthttp://dx.doi.org/10.1002/humu.21095",NA,NA,NA,"Cornelia de Lange Syndrome (CdLS) is a dominantly inherited heterogeneous genetic disorder with multisystem abnormalities. Sixty percent of probands with CdLS have heterozygous mutations in the Nipped-B-like (NIPBL) gene, 5% have mutations in the SMC1A gene, and one proband was found to have a mutation in the SMC3 gene. Cohesin is a multisubunit complex consisting of a SMC1A and SMC3 heterodimer and two non-SMC subunits. SMC1A is located on the human X chromosome and is reported to escape X inactivation. Twenty-nine unrelated CdLS probands with 21 unique SMC1A mutations have been identified including seven males. All mutations identified to date are either missense or small deletions, with all presumably preserving the protein open reading frame. Both wild-type and mutant alleles are expressed. Females quantitatively express twice the amount of SMC1A mRNA compared to males. The transcriptional profiling of 23 selected genes is different in SMC1A mutant probands, controls, and NIPBL mutant probands. These results suggest that mechanistically SMC1A-related CdLS is not due to altered levels of the SMC1A transcript, but rather that the mutant proteins maintain a residual function in males and enact a dominant negative effect in females. © 2009 Wiley-Liss, Inc.","L355564733 2009-11-30","10.1002/humu.21095","cohesin;genomic DNA;heterodimer;messenger RNA;mutant protein;protein subunit;smc1a;unclassified drug;allele;article;blood sampling;codon;controlled study;de Lange syndrome;deletion mutant;female;gene expression;genetic analysis;genetic transcription;heterozygote;human;male;microarray analysis;missense mutation;nucleotide sequence;open reading frame;pathogenicity;priority journal;progeny;reverse transcription polymerase chain reaction;sex difference;X chromosome inactivation;X chromosome linked disorder",NA,NA
"182","rayyan-902924854","Landscape of DNA methylation on the X chromosome reflects CpG density, functional chromatin state and X-chromosome inactivation",2015,NA,NA,"Human Molecular Genetics","1460-2083 0964-6906",24,6,"1528-1539","Cotton, A. M. and Price, E. M. and Jones, M. J. and Balaton, B. P. and Kobor, M. S. and Brown, C. J.","https://www.embase.com/search/results?subaction=viewrecord&id=L605131509&from=exporthttp://dx.doi.org/10.1093/hmg/ddu564",NA,NA,NA,"X-chromosome inactivation (XCI) achieves dosage compensation between males and females through the silencing of the majority of genes on one of the female X chromosomes. Thus, the female X chromosomes provide a unique opportunity to study euchromatin and heterochromatin of allelic regions within the same nuclear environment. We examined the interplay of DNA methylation (DNAm) with CpG density, transcriptional activity and chromatin state at genes on the X chromosome using over 1800 female samples analysed with the Illumina Infinium Human Methylation450 BeadChip. DNAm was used to predict an inactivation status for 63 novel transcription start sites (TSSs) across 27 tissues. There was high concordance of inactivation status across tissues, with 62% of TSSs subject to XCI in all 27 tissues examined, whereas 9% escaped from XCI in all tissues, and the remainder showed variable escape from XCI between females in subsets of tissues. Inter-female and twin data supported a model of predominately cis-acting influences on inactivation status. The level of expression from the inactive X relative to the active X correlated with the amount of female promoter DNAm to a threshold of ~30%, beyond which genes were consistently subject to inactivation. The inactive X showed lower DNAm than the active X at intragenic and intergenic regions for genes subject to XCI, but not at genes that escape from inactivation. Our categorization of genes that escape from X inactivation provides candidates for sex-specific differences in disease.","L605131509 2015-07-13 2021-07-13","10.1093/hmg/ddu564","cis acting element;DNA;intragenic region;spacer DNA;trans acting factor;unclassified drug;article;chromatin;controlled study;cpg density;CpG island;density;DNA methylation;enhancer region;female;gene expression profiling;genetic association;genetic correlation;genetic transcription;human;human cell;human tissue;major clinical study;male;nucleotide sequence;prediction;priority journal;promoter region;sex difference;transcription initiation site;twins;X chromosome;X chromosome inactivation;X Chromosome;DNA (Cytosine-5-)-Methyltransferase;Methylation",NA,NA
"183","rayyan-902924855","Current concepts: The biology of human sex differences",2006,4,6,"New England Journal of Medicine","0028-4793 1533-4406 J9 - NEW ENGL J MED",354,14,"1507-1514","Federman, D. D.","",NA,NA,NA,"","Times Cited in Web of Science Core Collection: 94 Total Times Cited: 99 Cited Reference Count: 32","10.1056/NEJMra052529","estrogen-receptors;x-inactivation;y-chromosome;gene;coregulators;deficiency;sequence;region;DNA;Humanities;Humanism;Humans;Sex Characteristics",NA,NA
"184","rayyan-902924856","Long noncoding RNA XIST: Mechanisms for X chromosome inactivation, roles in sex-biased diseases, and therapeutic opportunities",2022,NA,NA,"Genes and Diseases","2352-3042",9,6,"1478-1492","Li, J. and Ming, Z. and Yang, L. and Wang, T. and Liu, G. and Ma, Q.","https://www.embase.com/search/results?subaction=viewrecord&id=L2018357719&from=exporthttp://dx.doi.org/10.1016/j.gendis.2022.04.007",NA,NA,NA,"Sexual dimorphism has been reported in various human diseases including autoimmune diseases, neurological diseases, pulmonary arterial hypertension, and some types of cancers, although the underlying mechanisms remain poorly understood. The long noncoding RNA (lncRNA) X-inactive specific transcript (XIST) is involved in X chromosome inactivation (XCI) in female placental mammals, a process that ensures the balanced expression dosage of X-linked genes between sexes. XIST is abnormally expressed in many sex-biased diseases. In addition, escape from XIST-mediated XCI and skewed XCI also contribute to sex-biased diseases. Therefore, its expression or modification can be regarded as a biomarker for the diagnosis and prognosis of many sex-biased diseases. Genetic manipulation of XIST expression can inhibit the progression of some of these diseases in animal models, and therefore XIST has been proposed as a potential therapeutic target. In this manuscript, we summarize the current knowledge about the mechanisms for XIST-mediated XCI and the roles of XIST in sex-biased diseases, and discuss potential therapeutic strategies targeting XIST.","L2018357719 2022-05-27","10.1016/j.gendis.2022.04.007","adult;animal experiment;animal model;autoimmune disease;cancer prognosis;controlled study;epigenetics;female;gene expression;genetic manipulation;genetic transcription;human;male;malignant neoplasm;neurologic disease;nonhuman;placental mammal;prognosis;protein expression;protein function;pulmonary hypertension;review;sex difference;X chromosome inactivation;biological marker;endogenous compound;long untranslated RNA;X Chromosome",NA,NA
"185","rayyan-902924857","Dosage compensation and demasculinization of X chromosomes in Drosophila",2010,8,24,"Curr Biol","0960-9822 (Print) 0960-9822",20,16,"1476-1481","Bachtrog, D. and Toda, N. R. and Lockton, S.","",NA,NA,NA,"The X chromosome of Drosophila shows a deficiency of genes with male-biased expression, whereas mammalian X chromosomes are enriched for spermatogenesis genes expressed premeiosis and multicopy testis genes. Meiotic X-inactivation and sexual antagonism can only partly account for these patterns. Here, we show that dosage compensation (DC) in Drosophila may contribute substantially to the depletion of male genes on the X. To equalize expression between X-linked and autosomal genes in the two sexes, male Drosophila hypertranscribe their single X, whereas female mammals silence one of their two X chromosomes. We combine fine-scale mapping data of dosage compensated regions with genome-wide expression profiles and show that most male-biased genes on the D. melanogaster X are located outside dosage compensated regions. Additionally, X-linked genes that have newly acquired male-biased expression in D. melanogaster are less likely to be dosage compensated, and parental X-linked genes that gave rise to an autosomal male-biased retrocopy are more likely located within compensated regions. This suggests that DC contributes to the observed demasculinization of X chromosomes in Drosophila, both by limiting the emergence of male-biased expression patterns of existing X genes, and by contributing to gene trafficking of male genes off the X.","1879-0445 Bachtrog, Doris Toda, Nicholas R T Lockton, Steven R01 GM076007/GM/NIGMS NIH HHS/United States R01 GM076007-06/GM/NIGMS NIH HHS/United States R01GM093182/GM/NIGMS NIH HHS/United States R01GM076007/GM/NIGMS NIH HHS/United States Journal Article Research Support, N.I.H., Extramural Research Support, Non-U.S. Gov't England 2010/08/14 Curr Biol. 2010 Aug 24;20(16):1476-81. doi: 10.1016/j.cub.2010.06.076. Epub 2010 Aug 12.","10.1016/j.cub.2010.06.076","Animals;*Dosage Compensation, Genetic;Drosophila melanogaster/*genetics;Female;Gene Expression Regulation;Male;Models, Genetic;Retroelements;Sex Factors;*X Chromosome;X Chromosome",NA,NA
"186","rayyan-902924858","Inherent X-Linked Genetic Variability and Cellular Mosaicism Unique to Females Contribute to Sex-Related Differences in the Innate Immune Response",2017,NA,NA,"Front Immunol","1664-3224 (Print) 1664-3224",8,NA,"1455","Spolarics, Z. and Peña, G. and Qin, Y. and Donnelly, R. J. and Livingston, D. H.","",NA,NA,NA,"Females have a longer lifespan and better general health than males. Considerable number of studies also demonstrated that, after trauma and sepsis, females present better outcomes as compared to males indicating sex-related differences in the innate immune response. The current notion is that differences in the immuno-modulatory effects of sex hormones are the underlying causative mechanism. However, the field remains controversial and the exclusive role of sex hormones has been challenged. Here, we propose that polymorphic X-linked immune competent genes, which are abundant in the population are important players in sex-based immuno-modulation and play a key role in causing sex-related outcome differences following trauma or sepsis. We describe the differences in X chromosome (ChrX) regulation between males and females and its consequences in the context of common X-linked polymorphisms at the individual as well as population level. We also discuss the potential pathophysiological and immune-modulatory aspects of ChrX cellular mosaicism, which is unique to females and how this may contribute to sex-biased immune-modulation. The potential confounding effects of ChrX skewing of cell progenitors at the bone marrow is also presented together with aspects of acute trauma-induced de novo ChrX skewing at the periphery. In support of the hypothesis, novel observations indicating ChrX skewing in a female trauma cohort as well as case studies depicting the temporal relationship between trauma-induced cellular skewing and the clinical course are also described. Finally, we list and discuss a selected set of polymorphic X-linked genes, which are frequent in the population and have key regulatory or metabolic functions in the innate immune response and, therefore, are primary candidates for mediating sex-biased immune responses. We conclude that sex-related differences in a variety of disease processes including the innate inflammatory response to injury and infection may be related to the abundance of X-linked polymorphic immune-competent genes, differences in ChrX regulation, and inheritance patterns between the sexes and the presence of X-linked cellular mosaicism, which is unique to females.","1664-3224 Spolarics, Zoltan Peña, Geber Qin, Yong Donnelly, Robert J Livingston, David H R01 GM118602/GM/NIGMS NIH HHS/United States Journal Article Switzerland 2017/11/29 Front Immunol. 2017 Nov 13;8:1455. doi: 10.3389/fimmu.2017.01455. eCollection 2017.","10.3389/fimmu.2017.01455","X chromosome inactivation;X chromosome skewing;cellular mosaicism;infection;injury;sepsis;sexual dimorphism;Tocopherols",NA,NA
"187","rayyan-902924859","A TAD boundary is preserved upon deletion of the CTCF-rich Firre locus",2018,4,13,"Nat Commun","2041-1723",9,1,"1444","Barutcu, A. R. and Maass, P. G. and Lewandowski, J. P. and Weiner, C. L. and Rinn, J. L.","",NA,NA,NA,"The binding of the transcriptional regulator CTCF to the genome has been implicated in the formation of topologically associated domains (TADs). However, the general mechanisms of folding the genome into TADs are not fully understood. Here we test the effects of deleting a CTCF-rich locus on TAD boundary formation. Using genome-wide chromosome conformation capture (Hi-C), we focus on one TAD boundary on chromosome X harboring ~ 15 CTCF binding sites and located at the long non-coding RNA (lncRNA) locus Firre. Specifically, this TAD boundary is invariant across evolution, tissues, and temporal dynamics of X-chromosome inactivation. We demonstrate that neither the deletion of this locus nor the ectopic insertion of Firre cDNA or its ectopic expression are sufficient to alter TADs in a sex-specific or allele-specific manner. In contrast, Firre's deletion disrupts the chromatin super-loop formation of the inactive X-chromosome. Collectively, our findings suggest that apart from CTCF binding, additional mechanisms may play roles in establishing TAD boundary formation.","2041-1723 Barutcu, A Rasim Orcid: 0000-0002-4838-8695 Maass, Philipp G Orcid: 0000-0002-2742-8301 Lewandowski, Jordan P Weiner, Catherine L Orcid: 0000-0002-0183-968x Rinn, John L Orcid: 0000-0002-7231-7539 P01 GM099117/GM/NIGMS NIH HHS/United States R01 MH102416/MH/NIMH NIH HHS/United States U01 DA040612-01/NH/NIH HHS/United States R01 MH102416/NH/NIH HHS/United States Journal Article Research Support, N.I.H., Extramural Research Support, Non-U.S. Gov't England 2018/04/15 Nat Commun. 2018 Apr 13;9(1):1444. doi: 10.1038/s41467-018-03614-0.","10.1038/s41467-018-03614-0","Animals;Binding Sites;CCCTC-Binding Factor/*chemistry/genetics;Chromatin/chemistry;*Chromosomes, Human, X;DNA, Complementary/metabolism;Female;*Gene Deletion;Gene Library;Genome, Human;Humans;K562 Cells;Male;Mice;Mice, Knockout;Promoter Regions, Genetic;Protein Binding;Protein Domains;RNA, Long Noncoding/*genetics/metabolism;Repressor Proteins/metabolism;Sequence Deletion;Transcription, Genetic;X Chromosome;*X Chromosome Inactivation",NA,NA
"188","rayyan-902924860","Female human primordial germ cells display X-chromosome dosage compensation despite the absence of X-inactivation",2020,NA,NA,"Nature Cell Biology","1476-4679 1465-7392",22,12,"1436-1446","Chitiashvili, T. and Dror, I. and Kim, R. and Hsu, F. M. and Chaudhari, R. and Pandolfi, E. and Chen, D. and Liebscher, S. and Schenke-Layland, K. and Plath, K. and Clark, A.","https://www.embase.com/search/results?subaction=viewrecord&id=L2007470735&from=exporthttp://dx.doi.org/10.1038/s41556-020-00607-4",NA,NA,NA,"X-chromosome dosage compensation in female placental mammals is achieved by X-chromosome inactivation (XCI). Human pre-implantation embryos are an exception, in which dosage compensation occurs by X-chromosome dampening (XCD). Here, we examined whether XCD extends to human prenatal germ cells given their similarities to naive pluripotent cells. We found that female human primordial germ cells (hPGCs) display reduced X-linked gene expression before entering meiosis. Moreover, in hPGCs, both X chromosomes are active and express the long non-coding RNAs X active coating transcript (XACT) and X inactive specific transcript (XIST)—the master regulator of XCI—which are silenced after entry into meiosis. We find that XACT is a hPGC marker, describe XCD associated with XIST expression in hPGCs and suggest that XCD evolved in humans to regulate X-linked genes in pre-implantation embryos and PGCs. Furthermore, we found a unique mechanism of X-chromosome regulation in human primordial oocytes. Therefore, future studies of human germline development must consider the sexually dimorphic X-chromosome dosage compensation mechanisms in the prenatal germline.","L2007470735 2020-12-07 2020-12-18","10.1038/s41556-020-00607-4","long untranslated RNA;adult;article;controlled study;embryo;female;fetus;gene;gene expression;gene expression regulation;gene identification;human;human cell;male;meiosis;oogonium;preimplantation embryo;primordial germ cell;priority journal;sex difference;X chromosome;X chromosome inactivation;XACT gene;XIST gene;Humanities;Humanism;Humans",NA,NA
