"","key","title","year","month","day","journal","issn","volume","issue","pages","authors","url","language","publisher","location","abstract","notes","doi","keywords","pubmed_id","pmc_id"
"93","rayyan-902924765","X chromosome dosage of histone demethylase KDM5C determines sex differences in adiposity",2020,NA,NA,"Journal of Clinical Investigation","1558-8238 0021-9738",130,11,"5688-5702","Link, J. C. and Wiese, C. B. and Chen, X. and Avetisyan, R. and Ronquillo, E. and Ma, F. and Guo, X. and Yao, J. and Allison, M. and Chen, Y. D. I. and Rotter, J. I. and El-Sayed Moustafa, J. S. and Small, K. S. and Iwase, S. and Pellegrini, M. and Vergnes, L. and Arnold, A. P. and Reue, K.","https://www.embase.com/search/results?subaction=viewrecord&id=L2008457865&from=exporthttp://dx.doi.org/10.1172/JCI140223",NA,NA,NA,"Males and females differ in body composition and fat distribution. Using a mouse model that segregates gonadal sex (ovaries and testes) from chromosomal sex (XX and XY), we showed that XX chromosome complement in combination with a high-fat diet led to enhanced weight gain in the presence of male or female gonads. We identified the genomic dosage of Kdm5c, an X chromosome gene that escapes X chromosome inactivation, as a determinant of the X chromosome effect on adiposity. Modulating Kdm5c gene dosage in XX female mice to levels that are normally present in males resulted in reduced body weight, fat content, and food intake to a degree similar to that seen with altering the entire X chromosome dosage. In cultured preadipocytes, the levels of KDM5C histone demethylase influenced chromatin accessibility (ATAC-Seq), gene expression (RNA-Seq), and adipocyte differentiation. Both in vitro and in vivo, Kdm5c dosage influenced gene expression involved in extracellular matrix remodeling, which is critical for adipocyte differentiation and adipose tissue expansion. In humans, adipose tissue KDM5C mRNA levels and KDM5C genetic variants were associated with body mass. These studies demonstrate that the sex-dependent dosage of Kdm5c contributes to male/female differences in adipocyte biology and highlight X-escape genes as a critical component of female physiology.","L2008457865 2020-11-18 2020-12-22","10.1172/jci140223","histone demethylase;histone demethylase KDM5C;messenger RNA;unclassified drug;animal cell;animal experiment;animal model;animal tissue;article;cell culture;cell differentiation;chromatin;extracellular matrix;fat content;female;food intake;gene dosage;gene expression;genetic variability;gonad;in vitro study;in vivo study;karyotype 46,XX;kdm5c gene;lipid diet;male;mouse;nonhuman;obesity;ovary;priority journal;proadipocyte;protein expression;RNA sequencing;sex difference;testis;tissue expansion;X chromosome;X Chromosome;Sex Characteristics;Oxidoreductases, N-Demethylating;Oxidoreductases, O-Demethylating;Histones",NA,NA
"94","rayyan-902924766","Direct androgenic regulation of calcitonin gene-related peptide expression in motoneurons of rats with mosaic androgen insensitivity",1999,7,1,"Journal of Neuroscience","0270-6474 J9 - J NEUROSCI",19,13,"5597-5601","Monks, D. A. and Vanston, C. M. and Watson, N. V.","",NA,NA,NA,"The spinal nucleus of the bulbocavernosus (SNB) and its target muscles, bulbocavernosus and levator ani (BC/LA), form a sexually dimorphic neuromuscular circuit whose development and maintenance are androgen-dependent. The mechanisms whereby androgen regulates gene expression in the SNB of adult rats are largely unknown, although a retrograde influence from the BC/LA muscles has been suggested to underlie the suppression of calcitonin gene-related peptide (CGRP) expression observed in SNB motoneurons after systemic androgen treatment. A mosaic paradigm was used to determine the site of action of androgen in the regulation of CGRP expression in SNB motoneurons. As a consequence of random X chromosome inactivation, androgenized female rats heterozygous for the tfm androgen receptor (AR) mutation ((XXtfm)-X-wt-mosaics) express a mosaic of androgen-sensitive and androgen-insensitive motoneurons in the SNB, whereas the BC/LA target musculature appears to be uniformly sensitive to androgens. In adult mosaics, testosterone administration resulted in a reduction in the proportion of androgen-sensitive cells expressing CGRP, whereas no such reduction was observed in the androgen-insensitive population, indicating that neuronal AR plays an essential role in the neuromuscular regulation of CGRP expression in these motoneurons. This provides the first in vivo demonstration of AR regulation of gene expression unambiguously localized to a neuronal population.","Times Cited in Web of Science Core Collection: 27 Total Times Cited: 29 Cited Reference Count: 33","","mosaic;androgen receptor;spinal nucleus of the bulbocavernosus;bulbocavernosus;levator ani;sexual dimorphism;androgen;tfm mutation;penile reflexes;calcitonin gene-related peptide;cell autonomous;MESSENGER-RNA EXPRESSION;LEVATOR ANI MUSCLE;SPINAL NUCLEUS;RECEPTOR IMMUNOREACTIVITY;TESTOSTERONE;CORD;ALPHA;CGRP;DIFFERENTIATION;Virilism;Androgens;Calcitonin Gene-Related Peptide;Rats",NA,NA
"95","rayyan-902924767","Characterization of Sex-Based Dna Methylation Signatures in the Airways During Early Life",2018,NA,NA,"Scientific reports","2045-2322",8,1,"5526","Nino, C. L. and Perez, G. F. and Isaza, N. and Gutierrez, M. J. and Gomez, J. L. and Nino, G.","https://www.embase.com/search/results?subaction=viewrecord&id=L629315356&from=exporthttp://dx.doi.org/10.1038/s41598-018-23063-5",NA,NA,NA,"Human respiratory conditions are largely influenced by the individual's sex resulting in overall higher risk for males. Sex-based respiratory differences are present at birth suggesting a strong genetic component. Our objective was to characterize early life sex-based genomic signatures determined by variable X-chromosome methylation in the airways. We compared male versus female genome-wide DNA methylation in nasal airway samples from newborns and infants aged 1-6 months (N = 12). We analyzed methylation signals across CpG sites mapped to each X-linked gene using an unsupervised classifier (principal components) followed by an internal evaluation and an exhaustive cross-validation. Results were validated in an independent population of children (N = 72) following the same algorithm. X-linked genes with significant sex-based differential methylation in the nasal airway of infants represented only about 50% of the unique protein coding transcripts. X-linked genes without significant sex-based differential methylation included genes with evidence of escaping X-inactivation and female-biased airway expression. These genes showed similar methylation patterns in males and females suggesting unbalanced X-chromosome dosage. In conclusion, we identified that the human airways have already sex-based DNA methylation signatures at birth. These early airway epigenomic marks may determine sex-based respiratory phenotypes and overall predisposition to develop respiratory disorders later in life.","L629315356 2019-09-20 2019-10-10","10.1038/s41598-018-23063-5","CpG island;DNA methylation;epigenetics;female;genetics;human;immunology;infant;male;metabolism;newborn;nose mucosa;physiology;sexual characteristics;X chromosome;DNA (Cytosine-5-)-Methyltransferase;DNA, B-Form;DNA, A-Form;DNA-(Apurinic or Apyrimidinic Site) Lyase;Methylation;DNA",NA,NA
"96","rayyan-902924768","Sexual Inequality in the Cancer Cell",2018,10,1,"Cancer Research","0008-5472 1538-7445 J9 - CANCER RES",78,19,"5504-5505","Arnold, A. P. and Disteche, C. M.","",NA,NA,NA,"Investigating sex differences in cancer will improve therapy for both sexes and discover sex-specific protective mechanisms. Two recent analyses by Lopes-Ramos and colleagues and Li and colleagues point to specific gene regulatory networks and genomic alterations associated with sex differences in tumor incidence and progression. Integrating this information with emerging concepts about sex biases in the genome may help focus attention on factors that shift the odds for tumor growth. (C) 2018 AACR.","Times Cited in Web of Science Core Collection: 16 Total Times Cited: 16 Cited Reference Count: 10","10.1158/0008-5472.Can-18-2219","x-chromosome inactivation;Socioeconomic Factors",NA,NA
"97","rayyan-902924769","Bovine mammary gland X chromosome inactivation",2017,NA,NA,"Journal of dairy science","1525-3198",100,7,"5491-5500","Couldrey, C. and Johnson, T. and Lopdell, T. and Zhang, I. L. and Littlejohn, M. D. and Keehan, M. and Sherlock, R. G. and Tiplady, K. and Scott, A. and Davis, S. R. and Spelman, R. J.","https://www.embase.com/search/results?subaction=viewrecord&id=L622398426&from=exporthttp://dx.doi.org/10.3168/jds.2016-12490",NA,NA,NA,"X chromosome inactivation (XCI) is a process by which 1 of the 2 copies of the X chromosomes present in female mammals is inactivated. The transcriptional silencing of one X chromosome achieves dosage compensation between XX females and XY males and ensures equal expression of X-linked genes in both sexes. Although all mammals use this form of dosage compensation, the complex mechanisms that regulate XCI vary between species, tissues, and development. These mechanisms include not only varying levels of inactivation, but also the nature of inactivation, which can range from being random in nature to driven by parent of origin. To date, no data describing XCI in calves or adult cattle have been reported and we are reliant on data from mice to infer potential mechanisms and timings for this process. In the context of dairy cattle breeding and genomic prediction, the implications of X chromosome inheritance and XCI in the mammary gland are particularly important where a relatively small number of bulls pass their single X chromosome on to all of their daughters. We describe here the use of RNA-seq, whole genome sequencing and Illumina BovineHD BeadChip (Illumina, San Diego, CA) genotypes to assess XCI in lactating mammary glands of dairy cattle. At a population level, maternally and paternally inherited copies of the X chromosome are expressed equally in the lactating mammary gland consistent with random inactivation of the X chromosome. However, average expression of the paternal chromosome ranged from 10 to 90% depending on the individual animal. These results suggest that either the mammary gland arises from 1 or 2 stem cells, or a nongenetic mechanism that skews XCI exists. Although a considerable amount of future work is required to fully understand XCI in cattle, the data reported here represent an initial step in ensuring that X chromosome variation is captured and used in an appropriate manner for future genomic selection.","L622398426 2018-06-05","10.3168/jds.2016-12490","animal;bovine;female;gene expression regulation;genetics;lactation;male;sex factor;udder;X chromosome;X chromosome inactivation;X Chromosome",NA,NA
"98","rayyan-902924770","Long noncoding RNA FTX inhibits hepatocellular carcinoma proliferation and metastasis by binding MCM2 and miR-374a",2016,NA,NA,"Oncogene","1476-5594 0950-9232",35,41,"5422-5434","Liu, F. and Yuan, J. H. and Huang, J. F. and Yang, F. and Wang, T. T. and Ma, J. Z. and Zhang, L. and Zhou, C. C. and Wang, F. and Yu, J. and Zhou, W. P. and Sun, S. H.","https://www.embase.com/search/results?subaction=viewrecord&id=L609870646&from=exporthttp://dx.doi.org/10.1038/onc.2016.80",NA,NA,NA,"It has long been known that males are more susceptible than females to hepatocellular carcinoma (HCC), but the reason remains elusive. In this study, we investigated the expression and function of the long noncoding RNA FTX (lnc-FTX), an X-inactive-specific transcript (XIST) regulator transcribed from the X chromosome inactivation center, in both HCC and HCC gender disparity. lnc-FTX is expressed at higher levels in female livers than in male livers and is significantly downregulated in HCC tissues compared with normal liver tissues. Patients with higher lnc-FTX expression exhibited longer survival, suggesting that lnc-FTX is a useful prognostic factor for HCC patients. lnc-FTX inhibits HCC cell growth and metastasis both in vitro and in vivo. Mechanistically, lnc-FTX represses Wnt/β-catenin signaling activity by competitively sponging miR-374a and inhibits HCC cell epithelial-mesenchymal transition and invasion. In addition, lnc-FTX binds to the DNA replication licensing factor MCM2, thereby impeding DNA replication and inhibiting proliferation in HCC cells. In conclusion, these findings suggest that lnc-FTX may act as a tumor suppressor in HCC through physically binding miR-374a and MCM2. It may also be one of the reasons for HCC gender disparity and may potentially contribute to HCC treatment.","L609870646 2016-04-19 2016-11-11","10.1038/onc.2016.80","beta catenin;long untranslated RNA;long untranslated RNA FTX;microRNA;microRNA 374a;minichromosome maintenance protein 2;unclassified drug;Wnt protein;Wnt5a protein;adult;article;beta catenin gene;cancer growth;cancer inhibition;cancer prognosis;cancer survival;cell growth;controlled study;DNA replication;down regulation;epithelial mesenchymal transition;female;G1 phase cell cycle checkpoint;gene;gene expression regulation;gene repression;gene targeting;human;human tissue;in vitro study;in vivo study;liver cell carcinoma;major clinical study;male;metastasis;metastasis inhibition;mitosis inhibition;priority journal;protein RNA binding;PTEN gene;sex difference;signal transduction;survival time;upregulation;WIF1 gene;Wnt gene;WNT5A gene;X chromosome inactivation;Carcinoma, Hepatocellular;Neoplasm Metastasis",NA,NA
"99","rayyan-902924771","Plastin 3 in health and disease: a matter of balance",2021,NA,NA,"Cellular and Molecular Life Sciences","1420-9071 1420-682X",78,13,"5275-5301","Wolff, L. and Strathmann, E. A. and Müller, I. and Mählich, D. and Veltman, C. and Niehoff, A. and Wirth, B.","https://www.embase.com/search/results?subaction=viewrecord&id=L2011595324&from=exporthttp://dx.doi.org/10.1007/s00018-021-03843-5",NA,NA,NA,"For a long time, PLS3 (plastin 3, also known as T-plastin or fimbrin) has been considered a rather inconspicuous protein, involved in F-actin-binding and -bundling. However, in recent years, a plethora of discoveries have turned PLS3 into a highly interesting protein involved in many cellular processes, signaling pathways, and diseases. PLS3 is localized on the X-chromosome, but shows sex-specific, inter-individual and tissue-specific expression variability pointing towards skewed X-inactivation. PLS3 is expressed in all solid tissues but usually not in hematopoietic cells. When escaping X-inactivation, PLS3 triggers a plethora of different types of cancers. Elevated PLS3 levels are considered a prognostic biomarker for cancer and refractory response to therapies. When it is knocked out or mutated in humans and mice, it causes osteoporosis with bone fractures; it is the only protein involved in actin dynamics responsible for osteoporosis. Instead, when PLS3 is upregulated, it acts as a highly protective SMN-independent modifier in spinal muscular atrophy (SMA). Here, it seems to counteract reduced F-actin levels by restoring impaired endocytosis and disturbed calcium homeostasis caused by reduced SMN levels. In contrast, an upregulation of PLS3 on wild-type level might cause osteoarthritis. This emphasizes that the amount of PLS3 in our cells must be precisely balanced; both too much and too little can be detrimental. Actin-dynamics, regulated by PLS3 among others, are crucial in a lot of cellular processes including endocytosis, cell migration, axonal growth, neurotransmission, translation, and others. Also, PLS3 levels influence the infection with different bacteria, mycosis, and other pathogens.","L2011595324 2021-06-01","10.1007/s00018-021-03843-5","actin binding protein;calcium;calcium ion;copper zinc superoxide dismutase;protein CHP1;protein plastin 3;survival motor neuron protein;unclassified drug;acute myeloid leukemia;amyotrophic lateral sclerosis;aortic dissection;ataxia;bacterial infection;bladder cancer;breast cancer;calcium cell level;calcium homeostasis;cancer tissue;Candida albicans;cell migration;cell motility;colorectal cancer;cutaneous T cell lymphoma;disease association;endocytosis;enzyme regulation;gene expression;head and neck cancer;human;lung cancer;mycosis;nerve degeneration;neurite outgrowth;neurotransmission;nonhuman;osteoarthritis;osteoporosis;pancreas cancer;pathogenicity;PLS3 gene;prostate cancer;protein analysis;protein function;protein structure;review;Rickettsia;Salmonella enterica serovar Typhimurium;Sezary syndrome;Shigella flexneri;signal transduction;spinal muscular atrophy;stomach cancer;Trichomonas vaginalis;upregulation",NA,NA
"100","rayyan-902924772","Battle of the sexes: Conflict over dosage-sensitive genes and the origin of X chromosome inactivation",2012,NA,NA,"Proceedings of the National Academy of Sciences of the United States of America","0027-8424 1091-6490",109,14,"5144-5145","Wright, A. E. and Mank, J. E.","https://www.embase.com/search/results?subaction=viewrecord&id=L364582919&from=exporthttp://dx.doi.org/10.1073/pnas.1202905109",NA,NA,NA,"","L364582919 2012-04-13 2012-04-18","10.1073/pnas.1202905109","gene dosage;gene expression;gene locus;gene overexpression;gene silencing;genetic transcription;nonhuman;note;priority journal;sex chromosome;sex difference;transcription regulation;X chromosome;X chromosome inactivation;X Chromosome",NA,NA
"150","rayyan-902924822","Comparison of factor IX methylation on human active and inactive X chromosomes: implications for X inactivation and transcription of tissue-specific genes",1986,NA,NA,"The EMBO journal","0261-4189",5,9,"2223-2229","Cullen, C. R. and Hubberman, P. and Kaslow, D. C. and Migeon, B. R.","https://www.embase.com/search/results?subaction=viewrecord&id=L16779599&from=export",NA,NA,NA,"Maintenance of dosage compensation for housekeeping genes on the human X chromosome is mediated through differential methylation of clustered CpG nucleotides associated with these genes. To determine if methylation has a role in maintaining inactivity of X-linked genes which show tissue-specific expression, we examined the locus for blood clotting Factor IX. The analysis encompassed 91% of the HpaII and HhaI sites in the 41-kb region that includes the presumed promoter region, 5 kb of 5'- and 4 kb of 3'-flanking sequences. Although there are sex differences in methylation of the locus in leukocytes, the methylation pattern in liver, where the gene is expressed, is essentially the same for loci on the active and inactive X chromosome. The lack of differences in methylation of active and inactive genes makes it unlikely that methylation within the locus has a role in expression of the Factor IX gene. These findings, along with the absence of clustered CpG dinucleotides within the Factor IX locus, suggest that functional differences in DNA methylation related to X chromosome dosage compensation may be limited to CpG clusters. In any event, dosage compensation seems to be maintained regionally, rather than locus by locus.","L16779599 1986-12-19","","blood clotting factor 9;article;female;fibroblast;gene;genetic transcription;genetics;human;leukocyte;liver;lymphocyte;male;metabolism;methylation;placenta;pregnancy;restriction fragment length polymorphism;sexual development;X chromosome;Humanities;Humanism;Humans",NA,NA
"151","rayyan-902924823","Molecular analysis of females manifesting thyroxine-binding globulin (TBG) deficiency: Selective X-chromosome inactivation responsible for the difference between phenotype and genotype in TBG-deficient females",1996,NA,NA,"Journal of Clinical Endocrinology and Metabolism","0021-972X",81,6,"2204-2208","Okamoto, H. and Mori, Y. and Tani, Y. and Nakagomi, Y. and Sano, T. and Ohyama, K. and Saito, H. and Oiso, Y.","https://www.embase.com/search/results?subaction=viewrecord&id=L26176710&from=exporthttp://dx.doi.org/10.1210/jc.81.6.2204",NA,NA,NA,"T4-binding globulin (TBG) is the major transport protein of thyroid hormone in man. Inherited TBG abnormalities were manifested fully in hemizygous males and partially in heterozygous females and transmitted in an X-chromosome-linked fashion, compatible with its location on Xq21-22. We have previously reported that complete deficiency (CD) and partial deficiency (PD) in Japanese subjects resulted from two distinct mutations of the TBG gene, TBG-CDJ and TBG-PDJ, respectively. Recently, we encountered a female manifesting TBG-CD and herein investigated the molecular mechanisms. She was found to possess TBG-CDJ and common-type TBG (TBG-C) alleles by characterizing the TBG gene. Then, X-chromosome inactivation status was evaluated in her family members using a phosphoglycerate kinase (PGK) gene, located on Xq13. Three TBG-CDJ heterozygotes and one unaffected female, confirmed to be PGK heterozygotes for a polymorphic BstXI site, were analyzed. Only the CD female was shown to undergo selective inactivation by examining the BstXI site in amplified products after digestion with a methylation sensitive enzyme, HpaII. Among an additional eight informative females with TBG deficiency, one heterozygous female for TBG-PDJ shared this selective inactivation pattern. Moreover, the X-chromosome with TBG-C was suggested to be inactivated selectively from the linkage of PGK and TBG alleles recognized in eight of nine family members. Selective X-chromosome inactivation was considered to be the cause of a female heterozygous for TBG- CDJ or -PDJ manifesting the same phenotype as a hemizygote.","L26176710 1996-06-24","10.1210/jc.81.6.2204","thyroxine binding globulin;article;chromosome Xq;clinical article;controlled study;female;genetic linkage;genotype;hormone deficiency;human;human cell;human tissue;molecular genetics;phenotype;priority journal;sex difference;thyroxine binding globulin deficiency;X chromosome inactivation;Thyroxine;Dextrothyroxine;Immunoglobulins, Intravenous;X Chromosome;Phenotype;Genotype",NA,NA
"152","rayyan-902924824","Sexual dimorphism in autoimmunity",2015,NA,NA,"Journal of Clinical Investigation","1558-8238 0021-9738",125,6,"2187-2193","Rubtsova, K. and Marrack, P. and Rubtsov, A. V.","https://www.embase.com/search/results?subaction=viewrecord&id=L604736218&from=exporthttp://dx.doi.org/10.1172/JCI78082",NA,NA,NA,"Autoimmune diseases occur when the immune system attacks and destroys the organs and tissues of its own host. Autoimmunity is the third most common type of disease in the United States. Because there is no cure for autoimmunity, it is extremely important to study the mechanisms that trigger these diseases. Most autoimmune diseases predominantly affect females, indicating a strong sex bias. Various factors, including sex hormones, the presence or absence of a second X chromosome, and sex-specific gut microbiota can influence gene expression in a sex-specific way. These changes in gene expression may, in turn, lead to susceptibility or protection from autoimmunity, creating a sex bias for autoimmune diseases. In this Review we discuss recent findings in the field of sex-dependent regulation of gene expression and autoimmunity.","L604736218 2015-06-10 2015-06-18","10.1172/jci78082","androgen;androgen receptor;Bruton tyrosine kinase;CD40 ligand;chemokine receptor CXCR3;estrogen;estrogen receptor;gamma interferon;interferon;interferon regulatory factor 5;interleukin 2 receptor gamma;interleukin 9 receptor;major histocompatibility antigen class 1;membrane protein;ogt protein;pattern recognition receptor;prolactin;protein;sex hormone;sphingosine 1 phosphate receptor;sphingosine 1 phosphate receptor 2;testosterone;toll like receptor 3;toll like receptor 7;toll like receptor 8;toll like receptor 9;transcription factor FOXP3;transcription factor T bet;unc 93 homolog b1;unclassified drug;unindexed drug;article;autoimmune disease;autoimmunity;B lymphocyte;castration;CD4+ T lymphocyte;CD8+ T lymphocyte;dendritic cell;feedback system;gene expression;hormone substitution;human;immunocompetent cell;innate immunity;intestine flora;karyotype 47,XXY;Klinefelter syndrome;macrophage;memory T lymphocyte;monocyte;multiple sclerosis;natural killer cell;nonhuman;peripheral blood mononuclear cell;positive feedback;pregnancy;priority journal;regulatory T lymphocyte;rheumatoid arthritis;scleroderma;sex difference;systemic lupus erythematosus;Turner syndrome;upregulation;wild type;X chromosome;X chromosome inactivation;Y chromosome",NA,NA
