"","key","title","year","month","day","journal","issn","volume","issue","pages","authors","url","language","publisher","location","abstract","notes","doi","keywords","pubmed_id","pmc_id"
"395","rayyan-902925067","Androgen spares androgen-insensitive motoneurons from apoptosis in the spinal nucleus of the bulbocavernosus in rats",1996,NA,NA,"Hormones and Behavior","0018-506X",30,4,"424-433","Freeman, L. M. and Watson, N. V. and Breedlove, S. M.","https://www.embase.com/search/results?subaction=viewrecord&id=L27148176&from=exporthttp://dx.doi.org/10.1006/hbeh.1996.0047",NA,NA,NA,"The spinal nucleus of the bulbocavernosus (SNB) is a sexually dimorphic motor nucleus in the rat lumbar spinal cord. The sex difference arises through the androgenic sparing of the motoneurons and their target muscles from ontogenetic cell death. Indirect evidence suggests that androgen acts on the target muscles rather than directly on SNB motoneurons to spare them from death. The testicular feminization mutation (Tfm), a defect in the androgen receptor (AR), blocks androgenic sparing of SNB motoneurons and their targets. The pattern of AR immunocytochemistry was previously found to be different in adult Tfm and wild-type rats: immunostaining was nuclear in most SNB cells of wild-type rats, but very few SNB cells display nuclear AR immunostaining in affected Tfm rats. Because the Tfm mutation is carried on the X chromosome, random X inactivation during development makes female carriers of Tfm (+/Ttm) genetic mosaics for androgen sensitivity. Tfm carriers, their wild-type sisters, and affected Tfm males were treated with perinatal testosterone and immunocytochemistry was used to detect androgen receptor in the SNB when the rats reached adulthood. Mosaic females could be distinguished from their wild-type sisters by external morphology. In such perinatally androgenized mosaics, adult SNB cells were equally divided between wild-type and Tfm genotype, as indicated by AR immunocytochemistry. In contrast, the pattern of AR immunocytochemistry in target muscles of mosaics appeared similar to that of wild-type females. These results indicate that early androgen spared both androgen-sensitive and -insensitive motoneurons from cell death, confirming a site of androgen action other than the motoneurons themselves.","L27148176 1997-05-11","10.1006/hbeh.1996.0047","androgen receptor;testosterone;animal experiment;apoptosis;article;controlled study;drug effect;female;lumbar spine;male;masculinization;motoneuron nucleus;mutant;nonhuman;phenotype;priority journal;rat;sex differentiation;subcutaneous drug administration;Apoptosis;Rats;Androgens;Virilism",NA,NA
"396","rayyan-902925068","""Woman effect"" on cardiomyopathy",2012,NA,NA,"Giornale Italiano di Cardiologia","1827-6806 1972-6481",13,6,"424-431","Biagini, E. and Berardini, A. and Graziosi, M. and Rosmini, S. and Pazzi, C. and Rapezzi, C.","https://www.embase.com/search/results?subaction=viewrecord&id=L365401246&from=exporthttp://dx.doi.org/10.1714/1073.11761",NA,NA,NA,"The role of a gender effect (that means differences in clinical manifestations, access to therapies and response to treatments according to gender) in cardiomyopathies remains a matter of debate. Although recent studies have evaluated the differences in the clinical features and prognosis between the two sexes, many issues remain to be elucidated. At present, the only sex-specific condition that affects females is peripartum cardiomyopathy. Recent evidence suggests a pathogenetic role of a prolactin derivative, and ongoing clinical trials are investigating the possibility of targeted therapies using prolactin secretion inhibitors, such as bromocriptine and carbegoline. Although women were considered so far only carriers of X-linked diseases (Anderson-Fabry disease, Danon disease, Hunter syndrome and dystrophinopathies), clinical experience showed a wide spectrum of clinical manifestations in females due to random X chromosome inactivation. Conversely, in mitochondrial diseases (with matrilineal inheritance), cardiomyopathies may occur in the context of clinical multisystemic involvement without significant gender-related differences. Autosomal inherited cardiomyopathies also show different phenotypes and prognostic impact according to gender. The hypothesis of a premenopausal protective role of female hormones towards myocardial involvement has been raised by recent data on transtiretin-related amyloidosis and hypertrophic cardiomyopathy. Preexisting cardiomyopathies may affect pregnancy, labor and delivery in women, since all these conditions are associated with important hemodynamic changes. Women with low-risk hypertrophic cardiomyopathy (asymptomatic and without left ventricular outflow tract gradient) usually can tolerate pregnancy. Conversely, women who are symptomatic before pregnancy or have severe hypertrophy with important outflow tract gradient are at higher risk and should be referred to a tertiary center to be evaluated on a case by case basis. Pregnancy in women with dilated cardiomyopathy and significant left ventricular systolic dysfunction represents a high-risk condition. In addition, information on the clinical course and potential complications in pregnant women with arrhythmogenic right ventricular cardiomyopathy or restrictive cardiomyopathy is limited to individual reports. © 2012 Il Pensiero Scientifico Editore.","L365401246 2012-08-16 2012-08-21","10.1714/1073.11761","bromocriptine;cabergoline;transthyretin;prolactin derivative;amyloidosis;autosomal inheritance;cardiomyopathy;Danon disease;obstetric delivery;disorders of mitochondrial functions;dystrophinopathy;Fabry disease;female;heart left ventricle outflow tract;heart right ventricle dysplasia;human;Hunter syndrome;hypertrophic cardiomyopathy;labor;left ventricular systolic dysfunction;peripartum cardiomyopathy;phenotype;pregnancy;pregnant woman;premenopause;prognosis;restrictive cardiomyopathy;review;sex difference;X chromosome inactivation;Cardiomyopathies",NA,NA
"397","rayyan-902925069","Sex Differences in Inflammatory Response and Acid-Base Balance in Prepubertal Children with Severe Sepsis",2017,4,NA,"Shock","1073-2322 1540-0514 J9 - SHOCK",47,4,"422-428","Lefevre, N. and Noyon, B. and Biarent, D. and Corazza, F. and Duchateau, J. and Casimir, G.","",NA,NA,NA,"Purpose and Methods: The severity and prognosis of various acute inflammatory conditions, such as sepsis, differ between males and females. The mechanisms underlying these sex differences probably involve both hormonal and genetic factors. In order to evaluate a possible genetic influence, we reviewed clinical signs and biological inflammatory markers of prepubertal children with severe sepsis admitted to the pediatric intensive care unit (PICU). Findings: A total of 142 prepubertal children, 66 girls and 76 boys, suffering from severe sepsis and admitted to the PICU were included. The survival rate demonstrated a tendency to be higher in females (P = 0.14). Maximum white blood cell count (23,800 cells/mu L [15,110-34,600] in girls vs. 19,025 cells/mu L [12,358-26,098] in boys, P = 0.02), neutrophil count (16,944 cells/mu L [10,620-27,540] vs. 13,756 cells/mu L [8410-20,110], P = 0.03), and C-reactive protein level (26.2 mg/dL [15.7-33.6] vs. 18.8 mg/dL [11.1-30.0], P = 0.04) were all significantly higher in girls. Girls also exhibited significantly longer fever duration (2 days [1-6] vs. 1 day [1-3] for the boys, P<0.01), lower pH on admission (7.32 [7.25-7.39] vs. 7.37 [7.31-7.43] P = 0.03), and lower base excess (-6 mEq/L [-10.7 to -0.8] vs. -2.3 mEq/L [-6.6 to -2.6], P<0.01), as well as lower bicarbonate levels (19.1 mEq/l [15.9-24.0] vs. 21.15 mEq/l [18.3-26.68], P = 0.04), when compared with the boys. Conclusions: Our study revealed higher neutrophilic inflammation, as well as lower pH on admission, in girls with severe sepsis; associated with longer fever duration, which could contribute to better pathogen clearance. However, further studies are needed to demonstrate the link between acidosis and modulation of the immune response.","Times Cited in Web of Science Core Collection: 5 Total Times Cited: 6 Cited Reference Count: 33","10.1097/shk.0000000000000773","Acidosis;gender difference;neutrophilic immune response;pediatric sepsis;GENDER-DIFFERENCES;CELLULAR MOSAICISM;X-INACTIVATION;HEALTH;EXPRESSION;MORTALITY;CYTOKINES;PROTEIN;Only Child;Child;Sex Characteristics;Acid-Base Equilibrium;Sepsis",NA,NA
"398","rayyan-902925070","The molecular aetiology of haemophilia A in a New Zealand patient group",2007,NA,NA,"Haemophilia","1351-8216 1365-2516",13,4,"420-427","Laurie, A. D. and Sheen, C. R. and Hanrahan, V. and Smith, M. P. and George, P. M.","https://www.embase.com/search/results?subaction=viewrecord&id=L47040173&from=exporthttp://dx.doi.org/10.1111/j.1365-2516.2007.01487.x",NA,NA,NA,"The genetic basis of haemophilia A (HA) is well-established, and many haematology services are supported by molecular biology laboratories that offer factor VIII genetic testing for HA patients. This report describes the results from factor VIII gene (F8) analysis of a New Zealand cohort of 45 proband HA patients. We screened all proband HA patients attending local clinics to determine the molecular basis of disease in each case. We also aimed to evaluate the significance of founder effect in this population and to explain an unusual case of HA in a female patient. HA patients were screened for the common F8 gene inversion mutations using previously described PCR-based techniques, and for single base substitution mutations using denaturing high performance liquid chromatography and DNA sequencing. Analysis of microsatellite markers located within or near F8 was used to determine identity by descent and trace inheritance patterns of disease alleles. X-chromosome inactivation (XCI) patterns were detected using methylation specific PCR. Pathogenic F8 gene mutations were detected in all 45 HA patients in this cohort and non-random XCI was confirmed in a female haemophiliac. We report nine novel F8 mutations, including two splicing mutations, a five nucleotide deletion and a large deletion at the 5′ end of the gene. The molecular aetiology of HA was similar to that described in other studies but the distribution of mutations was unusual due to founder effects, with almost a quarter of all probands being descended from just three individuals. © 2007 The Authors Journal compliation 2007 Blackwell Publishing Ltd.","L47040173 2007-07-01","10.1111/j.1365-2516.2007.01487.x","blood clotting factor 8;nucleic acid;5' untranslated region;amino acid substitution;article;chromosome band;chromosome inactivation;chromosome inversion;clinical article;cohort analysis;controlled study;denaturing high performance liquid chromatography;DNA sequence;female;founder effect;gene location;gene mutation;genetic analysis;genetic screening;hemophilia A;human;inheritance;male;microsatellite marker;New Zealand;nucleic acid base substitution;nucleotide sequence;polymerase chain reaction;priority journal;sex difference;X chromosome;Hemophilia A;Hemophilia B",NA,NA
"399","rayyan-902925071","Dosage compensation, the origin and the afterlife of sex chromosomes",2006,NA,NA,"Chromosome Res","0967-3849 (Print) 0967-3849",14,4,"417-431","Larsson, J. and Meller, V. H.","",NA,NA,NA,"Over the past 100 years Drosophila has been developed into an outstanding model system for the study of evolutionary processes. A fascinating aspect of evolution is the differentiation of sex chromosomes. Organisms with highly differentiated sex chromosomes, such as the mammalian X and Y, must compensate for the imbalance in gene dosage that this creates. The need to adjust the expression of sex-linked genes is a potent force driving the rise of regulatory mechanisms that act on an entire chromosome. This review will contrast the process of dosage compensation in Drosophila with the divergent strategies adopted by other model organisms. While the machinery of sex chromosome compensation is different in each instance, all share the ability to direct chromatin modifications to an entire chromosome. This review will also explore the idea that chromosome-targeting systems are sometimes adapted for other purposes. This appears the likely source of a chromosome-wide targeting system displayed by the Drosophila fourth chromosome.","Larsson, Jan Meller, Victoria H Journal Article Review Netherlands 2006/07/06 Chromosome Res. 2006;14(4):417-31. doi: 10.1007/s10577-006-1064-3.","10.1007/s10577-006-1064-3","Animals;Chromosomes/genetics;Dosage Compensation, Genetic/*genetics;Drosophila/*genetics;Drosophila Proteins/genetics;Female;Gene Expression Regulation;Male;Recombination, Genetic/genetics;Sex Chromosomes/*genetics;Sex Factors;Transcription Factors;X Chromosome Inactivation/genetics;Sex Chromosomes",NA,NA
"400","rayyan-902925072","Higher order chromatin structure at the X-inactivation center via looping DNA",2008,NA,NA,"Developmental Biology","0012-1606",319,2,"416-425","Tsai, C. L. and Rowntree, R. K. and Cohen, D. E. and Lee, J. T.","https://www.embase.com/search/results?subaction=viewrecord&id=L50154355&from=exporthttp://dx.doi.org/10.1016/j.ydbio.2008.04.010",NA,NA,NA,"In mammals, the silencing step of the X-chromosome inactivation (XCI) process is initiated by the non-coding Xist RNA. Xist is known to be controlled by the non-coding Xite and Tsix loci, but the mechanisms by which Tsix and Xite regulate Xist are yet to be fully elucidated. Here, we examine the role of higher order chromatin structure across the 100-kb region of the mouse X-inactivation center (Xic) and map domains of specialized chromatin in vivo. By hypersensitive site mapping and chromosome conformation capture (3C), we identify two domains of higher order chromatin structure. Xite makes looping interactions with Tsix, while Xist makes contacts with Jpx/Enox, another non-coding gene not previously implicated in XCI. These regions interact in a developmentally-specific and sex-specific manner that is consistent with a regulatory role in XCI. We propose that dynamic changes in three-dimensional architecture leads to formation of separate chromatin hubs in Tsix and Xist that together regulate the initiation of X-chromosome inactivation. © 2008 Elsevier Inc. All rights reserved.","L50154355 2008-08-13","10.1016/j.ydbio.2008.04.010","animal cell;article;chromatin structure;controlled study;embryo;Enox gene;female;gene interaction;gene locus;Jpx gene;male;mouse;nonhuman;nucleotide sequence;priority journal;tsix gene;X chromosome inactivation;xist gene;Xite gene;DNA (Cytosine-5-)-Methyltransferase;DNA-(Apurinic or Apyrimidinic Site) Lyase;DNA, B-Form;DNA, A-Form;DNA",NA,NA
"500","rayyan-902925172","Genetic screening of C2399A SNP associated with the XPNPEP2 gene in South African hypertensive, ACE inhibitor induced angioedema in patients and controls",2009,NA,NA,"British Journal of Clinical Pharmacology","0306-5251",68,2,"291","Stark, J. and Moholisa, R. and Sturrock, E. and Rayner, B. and Owen, E.","https://www.embase.com/search/results?subaction=viewrecord&id=L70004856&from=exporthttp://dx.doi.org/10.1111/j.1365-2125.2009.03451.x",NA,NA,NA,"Angiotensin converting enzyme inhibitors (ACEi) are an important class of drugs widely used by more than 40 million patients worldwide. They are used as standard treatments for hypertension, congestive cardiac failure and diabetes. Angioedema is an adverse effect associated the use of ACEi which is significantly more common in Black and Coloured South Africans than in the Caucasian population. This serious adverse effect is frequently life-threatening and fatal. The use of ACEi such as enalapril precipitates severe anaphylactic reactions which are induced by activation of bradykinin, a vasodilatory and pro-inflammatory nonapeptide. Angioedema may only be associated with the use of enalapril and not other classes of ACEi such as perindopril or ramipril. The incidence of ACEi associated angioedema (AEi) as a life-threatening adverse effect has been associated with a single nucleotide polymorphism (SNP) C2399A in the XPNPEP2 gene which encodes membrane bound aminopeptidase (APP) enzyme [1]. The gene is located on the X chromosome. We performed a preliminary investigation to ascertain whether there is any association between AEi and the C2399A SNP genotype in the local Black and Coloured African population in Cape Town, South Africa. Patients were randomly recruited from the hypertension clinic at Groote Schuur Hospital, Cape Town. EDTA blood samples were collected from patients with a known history of AEi caused by enalapril (n = 24) and controls with hypertension on enalapril with no incidence of AEi for at least 2 years (n = 85). Allele-specific primers were used for the detection of the C or A allele associated with XPNPEP2. Female patients were also being investigated for X-inactivation patterns to detect subtle skewing of the ratio. To date a total of 24 patients with AEi have been tested, 18 were female (75%), 13 coloured (54%) and 11 (46%) Black African. When compared with controls 29% of Black African and 8% of coloured patients attending the hypertension clinic had a history of AEi. There were no gender differences between AEi patients and controls. All male patients exhibited either A or C allele genotypes. All female patients exhibited CC, AA or CA genotypes. In AEi patients the A allele frequency was 16% in males and 26% in females. In controls the A allele frequency was 33% in males and 28% in females. Lyonization of the X allele in females is still being investigated. In conclusion, more female than male and more Black African than coloured patients presented with enalapril-induced angio- edema at the hypertension clinic in Cape Town South Africa. Preliminary results indicate no association with C2399A in the XPNPEP2 gene to angioedema in these patients.","L70004856 2009-11-27","10.1111/j.1365-2125.2009.03451.x","dipeptidyl carboxypeptidase inhibitor;enalapril;bradykinin;nonapeptide;perindopril;ramipril;aminopeptidase;enzyme;edetic acid;patient;angioneurotic edema;gene;genetic screening;clinical pharmacology;society;female;hypertension;male;allele;outpatient department;genotype;city;adverse drug reaction;South Africa;population;gene frequency;X chromosome inactivation;single nucleotide polymorphism;membrane;X chromosome;diabetes mellitus;Caucasian;congestive heart failure;hospital;blood sampling;sex difference;anaphylaxis;edema;Angioedema;Genetic Testing;Mass Screening",NA,NA
"501","rayyan-902925173","Creative alternatives to diploid gene expression. Sex and Gene Expression, Graylyn Conference Center, Wake Forest University, Winston-Salem, NC, USA, 2-5 March 2000",2000,NA,NA,"Trends in Genetics","0168-9525",16,7,"290-291","Schachter, B.","https://www.embase.com/search/results?subaction=viewrecord&id=L30389595&from=exporthttp://dx.doi.org/10.1016/S0168-9525(00)02052-7",NA,NA,NA,"","L30389595 2000-07-02","10.1016/s0168-9525(00)02052-7","RNA;conference paper;embryo;female;gene expression;genome imprinting;male;mammal;nonhuman;priority journal;sex difference;X chromosome inactivation;Gene Expression;Wakefulness",NA,NA
"502","rayyan-902925174","Rethinking sex determination of non-gonadal tissues",2019,NA,NA,"Sex Determination in Vertebrates","0070-2153 978-0-12-811544-2 J9 - CURR TOP DEV BIOL",134,NA,"289-315","Arnold, A. P.","",NA,NA,NA,"Evolution of genetic mechanisms of sex determination led to two processes causing sex differences in somatic phenotypes: gonadal differentiation and sex chromosome dosage inequality. In species with heteromorphic sex chromosomes, the sex of the individual is established at the time of formation of the zygote, leading to inherent sex differences in expression of sex chromosome genes beginning as soon as the embryonic transcriptome is activated. The inequality of sex chromosome gene expression causes sexual differentiation of the gonads and of non-gonadal tissues. The difference in gonad type in turn causes lifelong differences in gonadal hormones, which interact with unequal effects of X and Y genes acting within cells. Separating the effects of gonadal hormones and sex chromosomes has been possible using mouse models in which gonadal determination is separated from the sex chromosomes, allowing comparison of XX and XY mice with the same type of gonad. Sex differences caused by gonadal hormones and sex chromosomes affect basic physiology and disease mechanisms in most or all tissues.","Times Cited in Web of Science Core Collection: 24 Total Times Cited: 24 Cited Reference Count: 95","10.1016/bs.ctdb.2019.01.003","dimorphic gene-expression;x-chromosome inactivation;y-chromosome;dosage compensation;stroke sensitivity;mouse models;complement;brain;evolution;hormones;Gonads",NA,NA
"503","rayyan-902925175","Non-Canonical and Sexually Dimorphic X Dosage Compensation States in the Mouse and Human Germline",2017,NA,NA,"Developmental Cell","1878-1551 1534-5807",40,3,"289-301.e283","Sangrithi, M. N. and Royo, H. and Mahadevaiah, S. K. and Ojarikre, O. and Bhaw, L. and Sesay, A. and Peters, A. H. F. M. and Stadler, M. and Turner, J. M. A.","https://www.embase.com/search/results?subaction=viewrecord&id=L614243243&from=exporthttp://dx.doi.org/10.1016/j.devcel.2016.12.023",NA,NA,NA,"Somatic X dosage compensation requires two mechanisms: X inactivation balances X gene output between males (XY) and females (XX), while X upregulation, hypothesized by Ohno and documented in vivo, balances X gene with autosomal gene output. Whether X dosage compensation occurs in germ cells is unclear. We show that mouse and human germ cells exhibit non-canonical X dosage states that differ from the soma and between the sexes. Prior to genome-wide reprogramming, X upregulation is present, consistent with Ohno's hypothesis. Subsequently, however, it is erased. In females, erasure follows loss of X inactivation, causing X dosage excess. Conversely, in males, erasure leads to permanent X dosage decompensation. Sex chromosomally abnormal models exhibit a “sex-reversed” X dosage state: XX males, like XX females, develop X dosage excess, while XO females, like XY males, develop X dosage decompensation. Thus, germline X dosage compensation states are determined by X chromosome number, not phenotypic sex. These unexpected differences in X dosage compensation states between germline and soma offer unique perspectives on sex chromosome infertility.","L614243243 2017-02-03 2017-02-14","10.1016/j.devcel.2016.12.023","animal cell;animal experiment;article;cell migration;chromosome number;controlled study;embryo;embryonic germ cell;female;gene expression regulation;human;human cell;karyotype 46,XX;karyotype 46,XY;male;meiosis;mouse;nonhuman;nuclear reprogramming;phenotype;priority journal;RNA sequence;sex chromosome aberration;sex determination;sex difference;somatic cell;subfertility;Turner syndrome;upregulation;X chromosome;X chromosome inactivation;Humanities;Humanism;Humans;Mice",NA,NA
